event_id,name,date,date_parsed,location,org_id,url,created_at
c0f1ad0dc1b9,UFC Fight Night: Emmett vs. Vallejos,"March 14, 2026",2026-03-14,"Las Vegas, Nevada, USA",ufc,http://www.ufcstats.com/event-details/babc6b5745335f18,2026-03-16 21:20:25
42713ade2247,UFC 326: Holloway vs. Oliveira 2,"March 07, 2026",2026-03-07,"Las Vegas, Nevada, USA",ufc,http://www.ufcstats.com/event-details/15ec018d144710db,2026-03-16 21:20:25
972193307843,UFC Fight Night: Moreno vs. Kavanagh,"February 28, 2026",2026-02-28,"Mexico City, Distrito Federal, Mexico",ufc,http://www.ufcstats.com/event-details/0cfbbfa0ba6d9855,2026-03-16 21:20:25
12654acafcd7,UFC Fight Night: Strickland vs. Hernandez,"February 21, 2026",2026-02-21,"Houston, Texas, USA",ufc,http://www.ufcstats.com/event-details/79ab17db3b40831a,2026-03-16 21:20:25
766b4b382704,UFC Fight Night: Bautista vs. Oliveira,"February 07, 2026",2026-02-07,"Las Vegas, Nevada, USA",ufc,http://www.ufcstats.com/event-details/c337c3c85b1871e0,2026-03-16 21:20:25
366be1a2b43f,UFC 325: Volkanovski vs. Lopes 2,"January 31, 2026",2026-01-31,"Sydney, New South Wales, Australia",ufc,http://www.ufcstats.com/event-details/30ad2050273d016a,2026-03-16 21:20:25
4e589a3d04bc,UFC 324: Gaethje vs. Pimblett,"January 24, 2026",2026-01-24,"Las Vegas, Nevada, USA",ufc,http://www.ufcstats.com/event-details/00e11b5c8b7bfeeb,2026-03-16 21:20:25
09d868df50e2,UFC Fight Night: Royval vs. Kape,"December 13, 2025",2025-12-13,"Las Vegas, Nevada, USA",ufc,http://www.ufcstats.com/event-details/bc0f994de0521926,2026-03-16 21:20:25
c2f4ec370a76,UFC 323: Dvalishvili vs. Yan 2,"December 06, 2025",2025-12-06,"Las Vegas, Nevada, USA",ufc,http://www.ufcstats.com/event-details/bd92cf5da5413d2a,2026-03-16 21:20:25
77b6ac05ab3d,UFC Fight Night: Tsarukyan vs. Hooker,"November 22, 2025",2025-11-22,"Doha, Qatar",ufc,http://www.ufcstats.com/event-details/92c96df8bdab5fea,2026-03-16 21:20:25
488320995508,UFC 322: Della Maddalena vs. Makhachev,"November 15, 2025",2025-11-15,"New York City, New York, USA",ufc,http://www.ufcstats.com/event-details/8db1b36dde268ef6,2026-03-16 21:20:25
54641305c157,UFC Fight Night: Bonfim vs. Brown,"November 08, 2025",2025-11-08,"Las Vegas, Nevada, USA",ufc,http://www.ufcstats.com/event-details/6436029b50a9c255,2026-03-16 21:20:25
a009a4f84ed4,UFC Fight Night: Garcia vs. Onama,"November 01, 2025",2025-11-01,"Las Vegas, Nevada, USA",ufc,http://www.ufcstats.com/event-details/0e2c2daf11b5d8f2,2026-03-16 21:20:25
6bc719521751,UFC 321: Aspinall vs. Gane,"October 25, 2025",2025-10-25,"Abu Dhabi, Abu Dhabi, United Arab Emirates",ufc,http://www.ufcstats.com/event-details/7956f026e2672c47,2026-03-16 21:20:25
35bc85eb041a,UFC Fight Night: De Ridder vs. Allen,"October 18, 2025",2025-10-18,"Vancouver, British Columbia, Canada",ufc,http://www.ufcstats.com/event-details/38e5d9dcb0fddc42,2026-03-16 21:20:25
8c3626b2218e,UFC Fight Night: Oliveira vs. Gamrot,"October 11, 2025",2025-10-11,"Rio de Janeiro, Rio de Janeiro, Brazil",ufc,http://www.ufcstats.com/event-details/9336e86cfd4ceaa1,2026-03-16 21:20:25
78e69dfa1e8e,UFC 320: Ankalaev vs. Pereira 2,"October 04, 2025",2025-10-04,"Las Vegas, Nevada, USA",ufc,http://www.ufcstats.com/event-details/8944a0f9b2f0ce6d,2026-03-16 21:20:25
b3feb944c173,UFC Fight Night: Ulberg vs. Reyes,"September 27, 2025",2025-09-27,"Perth, Western Australia, Australia",ufc,http://www.ufcstats.com/event-details/ed220e87bef0cc64,2026-03-16 21:20:25
f1ca13cf0ee0,UFC Fight Night: Lopes vs. Silva,"September 13, 2025",2025-09-13,"San Antonio, Texas, USA",ufc,http://www.ufcstats.com/event-details/5efaaf313b652dd7,2026-03-16 21:20:25
b03c479e6c40,UFC Fight Night: Imavov vs. Borralho,"September 06, 2025",2025-09-06,"Paris, Ile-de-France, France",ufc,http://www.ufcstats.com/event-details/6e380a4d73ab4f0e,2026-03-16 21:20:25
eb275f0fed5d,UFC Fight Night: Walker vs. Zhang,"August 23, 2025",2025-08-23,"Shanghai, Hebei, China",ufc,http://www.ufcstats.com/event-details/754968e325d6f60d,2026-03-16 21:20:25
f9d32fc4b189,UFC - Road to UFC 4.6,"August 22, 2025",2025-08-22,"Shanghai, Hebei, China",ufc,http://www.ufcstats.com/event-details/8fbcd82bf7f352bf,2026-03-16 21:20:25
cf39c14c794d,UFC 319: Du Plessis vs. Chimaev,"August 16, 2025",2025-08-16,"Chicago, Illinois, USA",ufc,http://www.ufcstats.com/event-details/421ccfc6ddb17958,2026-03-16 21:20:25
eb3f5021009b,UFC Fight Night: Dolidze vs. Hernandez,"August 09, 2025",2025-08-09,"Las Vegas, Nevada, USA",ufc,http://www.ufcstats.com/event-details/6cd3dfc54f01287f,2026-03-16 21:20:25
60dd46ea9681,UFC Fight Night: Taira vs. Park,"August 02, 2025",2025-08-02,"Las Vegas, Nevada, USA",ufc,http://www.ufcstats.com/event-details/f2c934689243fe4e,2026-03-16 21:20:25
764b050a6cd2,UFC Fight Night: Whittaker vs. De Ridder,"July 26, 2025",2025-07-26,"Abu Dhabi, Abu Dhabi, United Arab Emirates",ufc,http://www.ufcstats.com/event-details/28d8638ea0a71908,2026-03-16 21:20:25
79a43df29d3a,UFC 318: Holloway vs. Poirier 3,"July 19, 2025",2025-07-19,"New Orleans, Louisiana, USA",ufc,http://www.ufcstats.com/event-details/b8e2f10efb6eca85,2026-03-16 21:20:25
0d5d3a95ca71,UFC Fight Night: Lewis vs. Teixeira,"July 12, 2025",2025-07-12,"Nashville, Tennessee, USA",ufc,http://www.ufcstats.com/event-details/7b03d9df5910917d,2026-03-16 21:20:25
6d5ec40bb424,UFC 317: Topuria vs. Oliveira,"June 28, 2025",2025-06-28,"Las Vegas, Nevada, USA",ufc,http://www.ufcstats.com/event-details/66766984842c13dc,2026-03-16 21:20:25
6a71c297174a,UFC Fight Night: Hill vs. Rountree Jr.,"June 21, 2025",2025-06-21,"Baku, Azerbaijan",ufc,http://www.ufcstats.com/event-details/400c7b43c86d27d3,2026-03-16 21:20:25
84d1543f171f,UFC Fight Night: Usman vs. Buckley,"June 14, 2025",2025-06-14,"Atlanta, Georgia, USA",ufc,http://www.ufcstats.com/event-details/de277a4abcfeea46,2026-03-16 21:20:25
0dac5f463a4a,UFC 316: Dvalishvili vs. O'Malley 2,"June 07, 2025",2025-06-07,"Newark, New Jersey, USA",ufc,http://www.ufcstats.com/event-details/18c49685296c60e6,2026-03-16 21:20:25
5d5fb22b2fe1,UFC Fight Night: Blanchfield vs. Barber,"May 31, 2025",2025-05-31,"Las Vegas, Nevada, USA",ufc,http://www.ufcstats.com/event-details/2a898bf9fb7710b3,2026-03-16 21:20:25
337effecc9b7,UFC Fight Night: Burns vs. Morales,"May 17, 2025",2025-05-17,"Las Vegas, Nevada, USA",ufc,http://www.ufcstats.com/event-details/8ad022dd81224f61,2026-03-16 21:20:25
eb0aae385223,UFC 315: Muhammad vs. Della Maddalena,"May 10, 2025",2025-05-10,"Montreal, Quebec, Canada",ufc,http://www.ufcstats.com/event-details/118463dd8db16e7f,2026-03-16 21:20:25
589b0059b6be,UFC Fight Night: Sandhagen vs. Figueiredo,"May 03, 2025",2025-05-03,"Des Moines, Iowa, USA",ufc,http://www.ufcstats.com/event-details/de20ffb3fc2e7629,2026-03-16 21:20:25
be4e0be80be6,UFC Fight Night: Machado Garry vs. Prates,"April 26, 2025",2025-04-26,"Kansas City, Missouri, USA",ufc,http://www.ufcstats.com/event-details/b2e3aca4cd363477,2026-03-16 21:20:25
b2129f766068,UFC 314: Volkanovski vs. Lopes,"April 12, 2025",2025-04-12,"Miami, Florida, USA",ufc,http://www.ufcstats.com/event-details/22f4b6cb6b1bd7fd,2026-03-16 21:20:25
0ada4afc004f,UFC Fight Night: Emmett vs. Murphy,"April 05, 2025",2025-04-05,"Las Vegas, Nevada, USA",ufc,http://www.ufcstats.com/event-details/86b30a86664cb6e4,2026-03-16 21:20:25
0f1c745ab727,UFC Fight Night: Moreno vs. Erceg,"March 29, 2025",2025-03-29,"Mexico City, Distrito Federal, Mexico",ufc,http://www.ufcstats.com/event-details/0f7210aa8d61af8d,2026-03-16 21:20:25
28e36f158d44,UFC Fight Night: Edwards vs. Brady,"March 22, 2025",2025-03-22,"London, England, United Kingdom",ufc,http://www.ufcstats.com/event-details/cc2ad11b1f9d818b,2026-03-16 21:20:25
0f3c613a9279,UFC Fight Night: Vettori vs. Dolidze 2,"March 15, 2025",2025-03-15,"Las Vegas, Nevada, USA",ufc,http://www.ufcstats.com/event-details/39f62b833e4cf126,2026-03-16 21:20:25
14bf9b3587fa,UFC 313: Pereira vs. Ankalaev,"March 08, 2025",2025-03-08,"Las Vegas, Nevada, USA",ufc,http://www.ufcstats.com/event-details/ca936c67687789e9,2026-03-16 21:20:25
049cc90a5014,UFC Fight Night: Kape vs. Almabayev,"March 01, 2025",2025-03-01,"Las Vegas, Nevada, USA",ufc,http://www.ufcstats.com/event-details/9766ed20b68c7c33,2026-03-16 21:20:25
b184287faa05,UFC Fight Night: Cejudo vs. Song,"February 22, 2025",2025-02-22,"Seattle, Washington, USA",ufc,http://www.ufcstats.com/event-details/c50ea21fe9ef478d,2026-03-16 21:20:25
a7639dccd120,UFC Fight Night: Cannonier vs. Rodrigues,"February 15, 2025",2025-02-15,"Las Vegas, Nevada, USA",ufc,http://www.ufcstats.com/event-details/ce7871949b0ed2bf,2026-03-16 21:20:25
a09d89112785,UFC 312: Du Plessis vs. Strickland 2,"February 08, 2025",2025-02-08,"Sydney, New South Wales, Australia",ufc,http://www.ufcstats.com/event-details/e6015889f50075d2,2026-03-16 21:20:25
66fe0f1985ba,UFC Fight Night: Adesanya vs. Imavov,"February 01, 2025",2025-02-01,"Riyadh, Riyadh, Saudi Arabia",ufc,http://www.ufcstats.com/event-details/80dbeb1dd5b53e64,2026-03-16 21:20:25
8fa8f674b032,UFC 311: Makhachev vs. Moicano,"January 18, 2025",2025-01-18,"Inglewood, California, USA",ufc,http://www.ufcstats.com/event-details/39f68882def7a507,2026-03-16 21:20:25
1653a7b8e14a,UFC Fight Night: Dern vs. Ribas 2,"January 11, 2025",2025-01-11,"Las Vegas, Nevada, USA",ufc,http://www.ufcstats.com/event-details/81ddc98fceb30086,2026-03-16 21:20:25
de8c3de00a69,UFC Fight Night: Covington vs. Buckley,"December 14, 2024",2024-12-14,"Tampa, Florida, USA",ufc,http://www.ufcstats.com/event-details/72c9c2eadfc3277e,2026-03-16 21:20:25
eade722acd90,UFC 310: Pantoja vs. Asakura,"December 07, 2024",2024-12-07,"Las Vegas, Nevada, USA",ufc,http://www.ufcstats.com/event-details/ad23903ef3af7406,2026-03-16 21:20:25
729de7a0933c,UFC Fight Night: Yan vs. Figueiredo,"November 23, 2024",2024-11-23,"Macau, China",ufc,http://www.ufcstats.com/event-details/e955046551f8c7dd,2026-03-16 21:20:25
381388ff2e76,UFC 309: Jones vs. Miocic,"November 16, 2024",2024-11-16,"New York City, New York, USA",ufc,http://www.ufcstats.com/event-details/daff32bc96d1eabf,2026-03-16 21:20:25
652180be86ad,UFC Fight Night: Magny vs. Prates,"November 09, 2024",2024-11-09,"Las Vegas, Nevada, USA",ufc,http://www.ufcstats.com/event-details/585f9ffdb0cd0466,2026-03-16 21:20:25
032f13df6986,UFC Fight Night: Moreno vs. Albazi,"November 02, 2024",2024-11-02,"Edmonton, Alberta, Canada",ufc,http://www.ufcstats.com/event-details/3ab0df1ddd5f1dc2,2026-03-16 21:20:25
7f14308a7560,UFC 308: Topuria vs. Holloway,"October 26, 2024",2024-10-26,"Abu Dhabi, Abu Dhabi, United Arab Emirates",ufc,http://www.ufcstats.com/event-details/221b2a3070c7ce3e,2026-03-16 21:20:25
16d5f1ff5bcd,UFC Fight Night: Hernandez vs. Pereira,"October 19, 2024",2024-10-19,"Las Vegas, Nevada, USA",ufc,http://www.ufcstats.com/event-details/6a0047ac8c99fece,2026-03-16 21:20:25
8126196c9be0,UFC Fight Night: Royval vs. Taira,"October 12, 2024",2024-10-12,"Las Vegas, Nevada, USA",ufc,http://www.ufcstats.com/event-details/5bdcbd8dd681a257,2026-03-16 21:20:25
d56a9ecb5c0a,UFC 307: Pereira vs. Rountree Jr.,"October 05, 2024",2024-10-05,"Salt Lake City, Utah, USA",ufc,http://www.ufcstats.com/event-details/eee8efec7b951d84,2026-03-16 21:20:25
f7d12d7571e9,UFC Fight Night: Moicano vs. Saint Denis,"September 28, 2024",2024-09-28,"Paris, Ile-de-France, France",ufc,http://www.ufcstats.com/event-details/079488710f012779,2026-03-16 21:20:25
fa926b004f8b,UFC 306: Riyadh Season Noche UFC,"September 14, 2024",2024-09-14,"Las Vegas, Nevada, USA",ufc,http://www.ufcstats.com/event-details/0c01568b1ac77bff,2026-03-16 21:20:25
c52b722ba8ab,UFC Fight Night: Burns vs. Brady,"September 07, 2024",2024-09-07,"Las Vegas, Nevada, USA",ufc,http://www.ufcstats.com/event-details/ee0b69e307c857e5,2026-03-16 21:20:25
ee365cd3aa24,UFC Fight Night: Cannonier vs. Borralho,"August 24, 2024",2024-08-24,"Las Vegas, Nevada, USA",ufc,http://www.ufcstats.com/event-details/be8ad887e4d674b0,2026-03-16 21:20:25
24ae8875adea,UFC 305: Du Plessis vs. Adesanya,"August 17, 2024",2024-08-17,"Perth, Western Australia, Australia",ufc,http://www.ufcstats.com/event-details/32ba186f4b0e3267,2026-03-16 21:20:25
55e4bbe48753,UFC Fight Night: Tybura vs. Spivac 2,"August 10, 2024",2024-08-10,"Las Vegas, Nevada, USA",ufc,http://www.ufcstats.com/event-details/2c733e059462c1dc,2026-03-16 21:20:25
b5a29562d8ed,UFC Fight Night: Sandhagen vs. Nurmagomedov,"August 03, 2024",2024-08-03,"Abu Dhabi, Abu Dhabi, United Arab Emirates",ufc,http://www.ufcstats.com/event-details/fe435e440b5de0ff,2026-03-16 21:20:25
1a2b2a1bc8eb,UFC 304: Edwards vs. Muhammad 2,"July 27, 2024",2024-07-27,"Manchester, England, United Kingdom",ufc,http://www.ufcstats.com/event-details/026b4f7049085842,2026-03-16 21:20:25
ace8a48eb58a,UFC Fight Night: Lemos vs. Jandiroba,"July 20, 2024",2024-07-20,"Las Vegas, Nevada, USA",ufc,http://www.ufcstats.com/event-details/c11036da9162cb5f,2026-03-16 21:20:25
0fb0ab0a4253,UFC Fight Night: Namajunas vs. Cortez,"July 13, 2024",2024-07-13,"Denver, Colorado, USA",ufc,http://www.ufcstats.com/event-details/66e0a70352fef46a,2026-03-16 21:20:25
13658f59a13e,UFC 303: Pereira vs. Prochazka 2,"June 29, 2024",2024-06-29,"Las Vegas, Nevada, USA",ufc,http://www.ufcstats.com/event-details/f3743d8ef5dde970,2026-03-16 21:20:25
6a5d7b1eeaa8,UFC Fight Night: Whittaker vs. Aliskerov,"June 22, 2024",2024-06-22,"Riyadh, Riyadh, Saudi Arabia",ufc,http://www.ufcstats.com/event-details/b12a1d19ee383b7c,2026-03-16 21:20:25
7a1c77c2c46a,UFC Fight Night: Perez vs. Taira,"June 15, 2024",2024-06-15,"Las Vegas, Nevada, USA",ufc,http://www.ufcstats.com/event-details/9c5828c6fd9dc948,2026-03-16 21:20:25
b26e24380ae1,UFC Fight Night: Cannonier vs. Imavov,"June 08, 2024",2024-06-08,"Louisville, Kentucky, USA",ufc,http://www.ufcstats.com/event-details/cba3a2dfbc06ce79,2026-03-16 21:20:25
0bbfecebba93,UFC 302: Makhachev vs. Poirier,"June 01, 2024",2024-06-01,"Newark, New Jersey, USA",ufc,http://www.ufcstats.com/event-details/6e4acc2c115215b5,2026-03-16 21:20:25
cf72fbbc9fcf,UFC Fight Night: Barboza vs. Murphy,"May 18, 2024",2024-05-18,"Las Vegas, Nevada, USA",ufc,http://www.ufcstats.com/event-details/46baf0f57edfa4df,2026-03-16 21:20:25
2f7d46dbb9cb,UFC Fight Night: Lewis vs. Nascimento,"May 11, 2024",2024-05-11,"St. Louis, Missouri, USA",ufc,http://www.ufcstats.com/event-details/5dfe71ade71f3a4b,2026-03-16 21:20:25
b9dc6ce57116,UFC 301: Pantoja vs. Erceg,"May 04, 2024",2024-05-04,"Rio de Janeiro, Rio de Janeiro, Brazil",ufc,http://www.ufcstats.com/event-details/981ab7a0576f76a0,2026-03-16 21:20:25
8546e517a19c,UFC Fight Night: Nicolau vs. Perez,"April 27, 2024",2024-04-27,"Las Vegas, Nevada, USA",ufc,http://www.ufcstats.com/event-details/a16ce18149021139,2026-03-16 21:20:25
47f0dcc35162,UFC 300: Pereira vs. Hill,"April 13, 2024",2024-04-13,"Las Vegas, Nevada, USA",ufc,http://www.ufcstats.com/event-details/6750e338922a099d,2026-03-16 21:20:25
79a2aac84738,UFC Fight Night: Allen vs. Curtis 2,"April 06, 2024",2024-04-06,"Las Vegas, Nevada, USA",ufc,http://www.ufcstats.com/event-details/899eaba48fa864a6,2026-03-16 21:20:25
8af4b0bbd7ae,UFC Fight Night: Blanchfield vs. Fiorot,"March 30, 2024",2024-03-30,"Atlantic City, New Jersey, USA",ufc,http://www.ufcstats.com/event-details/dba230fe33011201,2026-03-16 21:20:25
545b12b4b205,UFC Fight Night: Ribas vs. Namajunas,"March 23, 2024",2024-03-23,"Las Vegas, Nevada, USA",ufc,http://www.ufcstats.com/event-details/79ff6545b0abc685,2026-03-16 21:20:25
8a4ce910f68d,UFC Fight Night: Tuivasa vs. Tybura,"March 16, 2024",2024-03-16,"Las Vegas, Nevada, USA",ufc,http://www.ufcstats.com/event-details/c398235fcaf8d71d,2026-03-16 21:20:25
b371396aaed6,UFC 299: O'Malley vs. Vera 2,"March 09, 2024",2024-03-09,"Miami, Florida, USA",ufc,http://www.ufcstats.com/event-details/a9df5ae20a97b090,2026-03-16 21:20:25
c163b4a67d63,UFC Fight Night: Rozenstruik vs. Gaziev,"March 02, 2024",2024-03-02,"Las Vegas, Nevada, USA",ufc,http://www.ufcstats.com/event-details/e4a9dbade7c7e1a7,2026-03-16 21:20:25
8226f514ead3,UFC Fight Night: Moreno vs. Royval 2,"February 24, 2024",2024-02-24,"Mexico City, Distrito Federal, Mexico",ufc,http://www.ufcstats.com/event-details/902ab9197b83d0db,2026-03-16 21:20:25
997b712a19a1,UFC 298: Volkanovski vs. Topuria,"February 17, 2024",2024-02-17,"Anaheim, California, USA",ufc,http://www.ufcstats.com/event-details/dab0e6cb8c932162,2026-03-16 21:20:25
9d48e3c1b7b4,UFC Fight Night: Hermansson vs. Pyfer,"February 10, 2024",2024-02-10,"Las Vegas, Nevada, USA",ufc,http://www.ufcstats.com/event-details/eaea0fc7b76525a8,2026-03-16 21:20:25
49b9e5d774f5,UFC Fight Night: Dolidze vs. Imavov,"February 03, 2024",2024-02-03,"Las Vegas, Nevada, USA",ufc,http://www.ufcstats.com/event-details/cce79e827569f26e,2026-03-16 21:20:25
5bbebfc25443,UFC 297: Strickland vs. Du Plessis,"January 20, 2024",2024-01-20,"Toronto, Ontario, Canada",ufc,http://www.ufcstats.com/event-details/bd85ca0bb4f26cfc,2026-03-16 21:20:25
4b045988db64,UFC Fight Night: Ankalaev vs. Walker 2,"January 13, 2024",2024-01-13,"Las Vegas, Nevada, USA",ufc,http://www.ufcstats.com/event-details/010986ee359fb863,2026-03-16 21:20:25
100cd8acb658,UFC 296: Edwards vs. Covington,"December 16, 2023",2023-12-16,"Las Vegas, Nevada, USA",ufc,http://www.ufcstats.com/event-details/a8e8587a06e73c87,2026-03-16 21:20:25
bd03f4dc35f5,UFC Fight Night: Song vs. Gutierrez,"December 09, 2023",2023-12-09,"Las Vegas, Nevada, USA",ufc,http://www.ufcstats.com/event-details/5ef0088c1b19beeb,2026-03-16 21:20:25
4e4c3d130657,UFC Fight Night: Dariush vs. Tsarukyan,"December 02, 2023",2023-12-02,"Austin, Texas, USA",ufc,http://www.ufcstats.com/event-details/53e4e21f4c688801,2026-03-16 21:20:25
9825f3b8645f,UFC Fight Night: Allen vs. Craig,"November 18, 2023",2023-11-18,"Las Vegas, Nevada, USA",ufc,http://www.ufcstats.com/event-details/3feed7d02711d8b7,2026-03-16 21:20:25
f9ae745381f7,UFC 295: Prochazka vs. Pereira,"November 11, 2023",2023-11-11,"New York City, New York, USA",ufc,http://www.ufcstats.com/event-details/5a558ba1ff5e9121,2026-03-16 21:20:25
29735987c008,UFC Fight Night: Almeida vs. Lewis,"November 04, 2023",2023-11-04,"Sao Paulo, Sao Paulo, Brazil",ufc,http://www.ufcstats.com/event-details/7c4ec656d8fcb867,2026-03-16 21:20:25
da2adc792825,UFC 294: Makhachev vs. Volkanovski 2,"October 21, 2023",2023-10-21,"Abu Dhabi, Abu Dhabi, United Arab Emirates",ufc,http://www.ufcstats.com/event-details/13a0fb8fbdafb54f,2026-03-16 21:20:25
02789e699343,UFC Fight Night: Yusuff vs. Barboza,"October 14, 2023",2023-10-14,"Las Vegas, Nevada, USA",ufc,http://www.ufcstats.com/event-details/f3a078277b3b8ff4,2026-03-16 21:20:25
b4caef201a7b,UFC Fight Night: Dawson vs. Green,"October 07, 2023",2023-10-07,"Las Vegas, Nevada, USA",ufc,http://www.ufcstats.com/event-details/c8a49ff2acb6f3c5,2026-03-16 21:20:25
3d3ca44fa8e4,UFC Fight Night: Fiziev vs. Gamrot,"September 23, 2023",2023-09-23,"Las Vegas, Nevada, USA",ufc,http://www.ufcstats.com/event-details/c945adc22c2bfe8f,2026-03-16 21:20:25
fb70600b0d5d,UFC Fight Night: Grasso vs. Shevchenko 2,"September 16, 2023",2023-09-16,"Las Vegas, Nevada, USA",ufc,http://www.ufcstats.com/event-details/8fa2b06572365321,2026-03-16 21:20:25
d964f429518a,UFC 293: Adesanya vs. Strickland,"September 09, 2023",2023-09-09,"Sydney, New South Wales, Australia",ufc,http://www.ufcstats.com/event-details/ece280745f8727b8,2026-03-16 21:20:25
dfee8e10285a,UFC Fight Night: Gane vs. Spivac,"September 02, 2023",2023-09-02,"Paris, Ile-de-France, France",ufc,http://www.ufcstats.com/event-details/ef61d9f5176b3200,2026-03-16 21:20:25
c6d3af069a04,UFC Fight Night: Holloway vs. The Korean Zombie,"August 26, 2023",2023-08-26,"Kallang, Singapore",ufc,http://www.ufcstats.com/event-details/89a407032911e27e,2026-03-16 21:20:25
2f48bd03bf88,UFC 292: Sterling vs. O'Malley,"August 19, 2023",2023-08-19,"Boston, Massachusetts, USA",ufc,http://www.ufcstats.com/event-details/2719f300b0439039,2026-03-16 21:20:25
71a5ef5e354e,UFC Fight Night: Luque vs. Dos Anjos,"August 12, 2023",2023-08-12,"Las Vegas, Nevada, USA",ufc,http://www.ufcstats.com/event-details/d2fa318f34d0aadc,2026-03-16 21:20:25
ecf27f086e71,UFC Fight Night: Sandhagen vs. Font,"August 05, 2023",2023-08-05,"Nashville, Tennessee, USA",ufc,http://www.ufcstats.com/event-details/6f81b6de2557739a,2026-03-16 21:20:25
d39b9c937984,UFC 291: Poirier vs. Gaethje 2,"July 29, 2023",2023-07-29,"Salt Lake City, Utah, USA",ufc,http://www.ufcstats.com/event-details/ccd58ff71e260ed5,2026-03-16 21:20:25
8b9ca211478d,UFC Fight Night: Aspinall vs. Tybura,"July 22, 2023",2023-07-22,"London, England, United Kingdom",ufc,http://www.ufcstats.com/event-details/1174782eacde9b0c,2026-03-16 21:20:25
897e8d62e5be,UFC Fight Night: Holm vs. Bueno Silva,"July 15, 2023",2023-07-15,"Las Vegas, Nevada, USA",ufc,http://www.ufcstats.com/event-details/c9885b1b7c7055a0,2026-03-16 21:20:25
e45d1a291f45,UFC 290: Volkanovski vs. Rodriguez,"July 08, 2023",2023-07-08,"Las Vegas, Nevada, USA",ufc,http://www.ufcstats.com/event-details/6085ceb59087514b,2026-03-16 21:20:25
b98ad00e6f66,UFC Fight Night: Strickland vs. Magomedov,"July 01, 2023",2023-07-01,"Las Vegas, Nevada, USA",ufc,http://www.ufcstats.com/event-details/e9e1acc96536bb4f,2026-03-16 21:20:25
77aacc6ac7b8,UFC Fight Night: Emmett vs. Topuria,"June 24, 2023",2023-06-24,"Jacksonville, Florida, USA",ufc,http://www.ufcstats.com/event-details/a780d16cf7eed44d,2026-03-16 21:20:25
34fa6808e899,UFC Fight Night: Vettori vs. Cannonier,"June 17, 2023",2023-06-17,"Las Vegas, Nevada, USA",ufc,http://www.ufcstats.com/event-details/b9415726dc3ec526,2026-03-16 21:20:25
d4a5e443842b,UFC 289: Nunes vs. Aldana,"June 10, 2023",2023-06-10,"Vancouver, British Columbia, Canada",ufc,http://www.ufcstats.com/event-details/b6c6d1731ff00eeb,2026-03-16 21:20:25
a6f1a390bfe5,UFC Fight Night: Kara-France vs. Albazi,"June 03, 2023",2023-06-03,"Las Vegas, Nevada, USA",ufc,http://www.ufcstats.com/event-details/7abe471b61725980,2026-03-16 21:20:25
5ba4bee71465,UFC Fight Night: Dern vs. Hill,"May 20, 2023",2023-05-20,"Las Vegas, Nevada, USA",ufc,http://www.ufcstats.com/event-details/6f812143641ceff8,2026-03-16 21:20:25
1bce1098176a,UFC Fight Night: Rozenstruik vs. Almeida,"May 13, 2023",2023-05-13,"Charlotte, North Carolina, USA",ufc,http://www.ufcstats.com/event-details/901cddcbfa079097,2026-03-16 21:20:25
f9f63346cbd7,UFC 288: Sterling vs. Cejudo,"May 06, 2023",2023-05-06,"Newark, New Jersey, USA",ufc,http://www.ufcstats.com/event-details/3c6976f8182d9527,2026-03-16 21:20:25
55a3246c5969,UFC Fight Night: Song vs. Simon,"April 29, 2023",2023-04-29,"Las Vegas, Nevada, USA",ufc,http://www.ufcstats.com/event-details/51b1e2fd9872005b,2026-03-16 21:20:25
a51867eff639,UFC Fight Night: Pavlovich vs. Blaydes,"April 22, 2023",2023-04-22,"Las Vegas, Nevada, USA",ufc,http://www.ufcstats.com/event-details/6fb1ba67bef41b37,2026-03-16 21:20:25
e4615ec4448b,UFC Fight Night: Holloway vs. Allen,"April 15, 2023",2023-04-15,"Kansas City, Missouri, USA",ufc,http://www.ufcstats.com/event-details/15b1b21cd743d652,2026-03-16 21:20:25
78ecedcf9c8a,UFC 287: Pereira vs. Adesanya 2,"April 08, 2023",2023-04-08,"Miami, Florida, USA",ufc,http://www.ufcstats.com/event-details/3dc3022232b79c7a,2026-03-16 21:20:25
f8d2aae30e6a,UFC Fight Night: Vera vs. Sandhagen,"March 25, 2023",2023-03-25,"San Antonio, Texas, USA",ufc,http://www.ufcstats.com/event-details/aec273fcb765330d,2026-03-16 21:20:25
8330c2cd5d56,UFC 286: Edwards vs. Usman 3,"March 18, 2023",2023-03-18,"London, England, United Kingdom",ufc,http://www.ufcstats.com/event-details/e4bb7e483c4ad318,2026-03-16 21:20:25
5e11f84cce3e,UFC Fight Night: Yan vs. Dvalishvili,"March 11, 2023",2023-03-11,"Las Vegas, Nevada, USA",ufc,http://www.ufcstats.com/event-details/35080a7f406f9ab3,2026-03-16 21:20:25
027c5cd46d70,UFC 285: Jones vs. Gane,"March 04, 2023",2023-03-04,"Las Vegas, Nevada, USA",ufc,http://www.ufcstats.com/event-details/1ccff7f0cfdf85eb,2026-03-16 21:20:25
78149d79d26b,UFC Fight Night: Muniz vs. Allen,"February 25, 2023",2023-02-25,"Las Vegas, Nevada, USA",ufc,http://www.ufcstats.com/event-details/806975e1b4f47b27,2026-03-16 21:20:25
b048a28dba0e,UFC Fight Night: Andrade vs. Blanchfield,"February 18, 2023",2023-02-18,"Las Vegas, Nevada, USA",ufc,http://www.ufcstats.com/event-details/f21a3d68fb9df387,2026-03-16 21:20:25
7403e5535b76,UFC 284: Makhachev vs. Volkanovski,"February 11, 2023",2023-02-11,"Perth, Western Australia, Australia",ufc,http://www.ufcstats.com/event-details/01dd4cdc2446f665,2026-03-16 21:20:25
32c7206a6a5e,UFC Fight Night: Lewis vs. Spivac,"February 04, 2023",2023-02-04,"Las Vegas, Nevada, USA",ufc,http://www.ufcstats.com/event-details/d26394fc0e8e880a,2026-03-16 21:20:25
215a1f6a469e,UFC 283: Teixeira vs. Hill,"January 21, 2023",2023-01-21,"Rio de Janeiro, Rio de Janeiro, Brazil",ufc,http://www.ufcstats.com/event-details/5717efc6f271cd52,2026-03-16 21:20:25
ce91128228a3,UFC Fight Night: Strickland vs. Imavov,"January 14, 2023",2023-01-14,"Las Vegas, Nevada, USA",ufc,http://www.ufcstats.com/event-details/2e2cdb6e9eb84bb9,2026-03-16 21:20:25
e4ae46936c61,UFC Fight Night: Cannonier vs. Strickland,"December 17, 2022",2022-12-17,"Las Vegas, Nevada, USA",ufc,http://www.ufcstats.com/event-details/56ec58954158966a,2026-03-16 21:20:25
eaf4e66b87b4,UFC 282: Blachowicz vs. Ankalaev,"December 10, 2022",2022-12-10,"Las Vegas, Nevada, USA",ufc,http://www.ufcstats.com/event-details/f65a0eb902f9476b,2026-03-16 21:20:25
84400f72b8e0,UFC Fight Night: Thompson vs. Holland,"December 03, 2022",2022-12-03,"Orlando, Florida, USA",ufc,http://www.ufcstats.com/event-details/b23388ff8ac6637b,2026-03-16 21:20:25
e5d356aa5dc3,UFC Fight Night: Nzechukwu vs. Cutelaba,"November 19, 2022",2022-11-19,"Las Vegas, Nevada, USA",ufc,http://www.ufcstats.com/event-details/012fc7cd0779c09a,2026-03-16 21:20:25
af90005e4efa,UFC 281: Adesanya vs. Pereira,"November 12, 2022",2022-11-12,"New York City, New York, USA",ufc,http://www.ufcstats.com/event-details/b3b6e80b7d5f8f0d,2026-03-16 21:20:25
