event_id,name,date,date_parsed,location,org_id,url,created_at
9e25921b18f4,UFC Fight Night: Rodriguez vs. Lemos,"November 05, 2022",2022-11-05,"Las Vegas, Nevada, USA",ufc,http://www.ufcstats.com/event-details/756f45905fb20cb5,2026-03-16 21:20:25
e84e481bce3e,UFC Fight Night: Kattar vs. Allen,"October 29, 2022",2022-10-29,"Las Vegas, Nevada, USA",ufc,http://www.ufcstats.com/event-details/be5aab761c40ef35,2026-03-16 21:20:25
6335eccf0a7e,UFC 280: Oliveira vs. Makhachev,"October 22, 2022",2022-10-22,"Abu Dhabi, Abu Dhabi, United Arab Emirates",ufc,http://www.ufcstats.com/event-details/885e7f70dcac0007,2026-03-16 21:20:25
a8d7dace358e,UFC Fight Night: Grasso vs. Araujo,"October 15, 2022",2022-10-15,"Las Vegas, Nevada, USA",ufc,http://www.ufcstats.com/event-details/49c29e57d4e2be6f,2026-03-16 21:20:25
a0be32a0197d,UFC Fight Night: Dern vs. Yan,"October 01, 2022",2022-10-01,"Las Vegas, Nevada, USA",ufc,http://www.ufcstats.com/event-details/4f670b7972fa0a2e,2026-03-16 21:20:25
19b741100024,UFC Fight Night: Sandhagen vs. Song,"September 17, 2022",2022-09-17,"Las Vegas, Nevada, USA",ufc,http://www.ufcstats.com/event-details/8d477c3fbe001f9d,2026-03-16 21:20:25
bf42cecf3060,UFC 279: Diaz vs. Ferguson,"September 10, 2022",2022-09-10,"Las Vegas, Nevada, USA",ufc,http://www.ufcstats.com/event-details/93bf96be327fcd98,2026-03-16 21:20:25
585c49c1509a,UFC Fight Night: Gane vs. Tuivasa,"September 03, 2022",2022-09-03,"Paris, Ile-de-France, France",ufc,http://www.ufcstats.com/event-details/00a905a4a4a2b071,2026-03-16 21:20:25
110de320ddc5,UFC 278: Usman vs. Edwards,"August 20, 2022",2022-08-20,"Salt Lake City, Utah, USA",ufc,http://www.ufcstats.com/event-details/4f853e98886283cf,2026-03-16 21:20:25
44a4debc463d,UFC Fight Night: Vera vs. Cruz,"August 13, 2022",2022-08-13,"San Diego, California, USA",ufc,http://www.ufcstats.com/event-details/a23e63184c65f5b8,2026-03-16 21:20:25
8bb3cf29ec23,UFC Fight Night: Santos vs. Hill,"August 06, 2022",2022-08-06,"Las Vegas, Nevada, USA",ufc,http://www.ufcstats.com/event-details/8f6a18831a120817,2026-03-16 21:20:25
7f25c2e0b90c,UFC 277: Pena vs. Nunes 2,"July 30, 2022",2022-07-30,"Dallas, Texas, USA",ufc,http://www.ufcstats.com/event-details/b0a6124751a56bc4,2026-03-16 21:20:25
a027a6d19179,UFC Fight Night: Blaydes vs. Aspinall,"July 23, 2022",2022-07-23,"London, England, United Kingdom",ufc,http://www.ufcstats.com/event-details/319c15b8aac5bfde,2026-03-16 21:20:25
5e09d3cce04b,UFC Fight Night: Ortega vs. Rodriguez,"July 16, 2022",2022-07-16,"Elmont, New York, USA",ufc,http://www.ufcstats.com/event-details/8fd76e1b49c00ae2,2026-03-16 21:20:25
83e56f35c612,UFC Fight Night: Dos Anjos vs. Fiziev,"July 09, 2022",2022-07-09,"Las Vegas, Nevada, USA",ufc,http://www.ufcstats.com/event-details/31da66df48c0c1a0,2026-03-16 21:20:25
61097cfdf3da,UFC 276: Adesanya vs. Cannonier,"July 02, 2022",2022-07-02,"Las Vegas, Nevada, USA",ufc,http://www.ufcstats.com/event-details/4a9e305633f3ef47,2026-03-16 21:20:25
840f0bf96e23,UFC Fight Night: Tsarukyan vs. Gamrot,"June 25, 2022",2022-06-25,"Las Vegas, Nevada, USA",ufc,http://www.ufcstats.com/event-details/eb42d4febfafefd1,2026-03-16 21:20:25
8a67b92b310c,UFC Fight Night: Kattar vs. Emmett,"June 18, 2022",2022-06-18,"Austin, Texas, USA",ufc,http://www.ufcstats.com/event-details/a0a680fe2f6cc8e6,2026-03-16 21:20:25
a264dd3b3371,UFC 275: Teixeira vs. Prochazka,"June 11, 2022",2022-06-11,"Kallang, Singapore",ufc,http://www.ufcstats.com/event-details/3a24769a4855040a,2026-03-16 21:20:25
a998d5ca3b90,UFC Fight Night: Volkov vs. Rozenstruik,"June 04, 2022",2022-06-04,"Las Vegas, Nevada, USA",ufc,http://www.ufcstats.com/event-details/57591bbf1623574e,2026-03-16 21:20:25
43def4d9d1a9,UFC Fight Night: Holm vs. Vieira,"May 21, 2022",2022-05-21,"Las Vegas, Nevada, USA",ufc,http://www.ufcstats.com/event-details/a6c32678efd4f434,2026-03-16 21:20:25
43262889e49b,UFC Fight Night: Blachowicz vs. Rakic,"May 14, 2022",2022-05-14,"Las Vegas, Nevada, USA",ufc,http://www.ufcstats.com/event-details/60ba33c3f555a7a3,2026-03-16 21:20:25
0605b5d4deaf,UFC 274: Oliveira vs. Gaethje,"May 07, 2022",2022-05-07,"Phoenix, Arizona, USA",ufc,http://www.ufcstats.com/event-details/253d3f9e97ca149a,2026-03-16 21:20:25
3fa541c77c3e,UFC Fight Night: Font vs. Vera,"April 30, 2022",2022-04-30,"Las Vegas, Nevada, USA",ufc,http://www.ufcstats.com/event-details/6bf5a7d3e081ade2,2026-03-16 21:20:25
7dbb6164fe22,UFC Fight Night: Lemos vs. Andrade,"April 23, 2022",2022-04-23,"Las Vegas, Nevada, USA",ufc,http://www.ufcstats.com/event-details/236a37d96d476164,2026-03-16 21:20:25
b4f574560cbb,UFC Fight Night: Luque vs. Muhammad,"April 16, 2022",2022-04-16,"Las Vegas, Nevada, USA",ufc,http://www.ufcstats.com/event-details/8753e125f4499816,2026-03-16 21:20:25
d2b62781a78e,UFC 273: Volkanovski vs. The Korean Zombie,"April 09, 2022",2022-04-09,"Jacksonville, Florida, USA",ufc,http://www.ufcstats.com/event-details/3a97fda0de6f1fa4,2026-03-16 21:20:25
ccd635025c0b,UFC Fight Night: Blaydes vs. Daukaus,"March 26, 2022",2022-03-26,"Columbus, Ohio, USA",ufc,http://www.ufcstats.com/event-details/1fac46d466abd5b8,2026-03-16 21:20:25
fe5123d857be,UFC Fight Night: Volkov vs. Aspinall,"March 19, 2022",2022-03-19,"London, England, United Kingdom",ufc,http://www.ufcstats.com/event-details/1d00756835ca67c9,2026-03-16 21:20:25
a8ea58630c9a,UFC Fight Night: Santos vs. Ankalaev,"March 12, 2022",2022-03-12,"Las Vegas, Nevada, USA",ufc,http://www.ufcstats.com/event-details/1f9344211ca7fd60,2026-03-16 21:20:25
40e8c6ee3e46,UFC 272: Covington vs. Masvidal,"March 05, 2022",2022-03-05,"Las Vegas, Nevada, USA",ufc,http://www.ufcstats.com/event-details/75e0d3cc2262b732,2026-03-16 21:20:25
5b9fa7efb957,UFC Fight Night: Makhachev vs. Green,"February 26, 2022",2022-02-26,"Las Vegas, Nevada, USA",ufc,http://www.ufcstats.com/event-details/f6a7b02c42e9fc5b,2026-03-16 21:20:25
c0896dd4cb0a,UFC Fight Night: Walker vs. Hill,"February 19, 2022",2022-02-19,"Las Vegas, Nevada, USA",ufc,http://www.ufcstats.com/event-details/77940e45bc86208e,2026-03-16 21:20:25
7b3ff4f264ab,UFC 271: Adesanya vs. Whittaker 2,"February 12, 2022",2022-02-12,"Houston, Texas, USA",ufc,http://www.ufcstats.com/event-details/cbb682f5fcc44bfc,2026-03-16 21:20:25
43ca0198dedd,UFC Fight Night: Hermansson vs. Strickland,"February 05, 2022",2022-02-05,"Las Vegas, Nevada, USA",ufc,http://www.ufcstats.com/event-details/883922e5cd6d8473,2026-03-16 21:20:25
b7364305c147,UFC 270: Ngannou vs. Gane,"January 22, 2022",2022-01-22,"Anaheim, California, USA",ufc,http://www.ufcstats.com/event-details/335ad945324c3a2e,2026-03-16 21:20:25
37e2bf427c66,UFC Fight Night: Kattar vs. Chikadze,"January 15, 2022",2022-01-15,"Las Vegas, Nevada, USA",ufc,http://www.ufcstats.com/event-details/f5585e675af7afd4,2026-03-16 21:20:25
dc72f2cb8f23,UFC Fight Night: Lewis vs. Daukaus,"December 18, 2021",2021-12-18,"Las Vegas, Nevada, USA",ufc,http://www.ufcstats.com/event-details/2a470ad41c22c25a,2026-03-16 21:20:25
19cebd85ee2a,UFC 269: Oliveira vs. Poirier,"December 11, 2021",2021-12-11,"Las Vegas, Nevada, USA",ufc,http://www.ufcstats.com/event-details/ef927e4fe2117ab8,2026-03-16 21:20:25
2bd3b6421fc0,UFC Fight Night: Font vs. Aldo,"December 04, 2021",2021-12-04,"Las Vegas, Nevada, USA",ufc,http://www.ufcstats.com/event-details/509697e08673d2e5,2026-03-16 21:20:25
d6145fe4e575,UFC Fight Night: Vieira vs. Tate,"November 20, 2021",2021-11-20,"Las Vegas, Nevada, USA",ufc,http://www.ufcstats.com/event-details/c95fbc085e17a532,2026-03-16 21:20:25
766bfb5f6552,UFC Fight Night: Holloway vs. Rodriguez,"November 13, 2021",2021-11-13,"Las Vegas, Nevada, USA",ufc,http://www.ufcstats.com/event-details/b5abaa65f87938eb,2026-03-16 21:20:25
367a0a8cab4a,UFC 268: Usman vs. Covington 2,"November 06, 2021",2021-11-06,"New York City, New York, USA",ufc,http://www.ufcstats.com/event-details/48e093ea1f43a053,2026-03-16 21:20:25
373fb8c3f3d4,UFC 267: Blachowicz vs. Teixeira,"October 30, 2021",2021-10-30,"Abu Dhabi, Abu Dhabi, United Arab Emirates",ufc,http://www.ufcstats.com/event-details/3974fa35c917af1d,2026-03-16 21:20:25
a9c5649960e5,UFC Fight Night: Costa vs. Vettori,"October 23, 2021",2021-10-23,"Las Vegas, Nevada, USA",ufc,http://www.ufcstats.com/event-details/8a9c6c4301f6d088,2026-03-16 21:20:25
162d3102e7a8,UFC Fight Night: Ladd vs. Dumont,"October 16, 2021",2021-10-16,"Las Vegas, Nevada, USA",ufc,http://www.ufcstats.com/event-details/8f4616698508f24d,2026-03-16 21:20:25
183694bcc341,UFC Fight Night: Dern vs. Rodriguez,"October 09, 2021",2021-10-09,"Las Vegas, Nevada, USA",ufc,http://www.ufcstats.com/event-details/d247691a6c0e9034,2026-03-16 21:20:25
574acf0f6853,UFC Fight Night: Santos vs. Walker,"October 02, 2021",2021-10-02,"Las Vegas, Nevada, USA",ufc,http://www.ufcstats.com/event-details/e15d0a2519d6a0b5,2026-03-16 21:20:25
bffb1db2a3ce,UFC 266: Volkanovski vs. Ortega,"September 25, 2021",2021-09-25,"Las Vegas, Nevada, USA",ufc,http://www.ufcstats.com/event-details/0eec866a077889f0,2026-03-16 21:20:25
6e62c12a6126,UFC Fight Night: Smith vs. Spann,"September 18, 2021",2021-09-18,"Las Vegas, Nevada, USA",ufc,http://www.ufcstats.com/event-details/4c27ca8c8481f79a,2026-03-16 21:20:25
b337b84218d6,UFC Fight Night: Brunson vs. Till,"September 04, 2021",2021-09-04,"Las Vegas, Nevada, USA",ufc,http://www.ufcstats.com/event-details/b9532d815060de7f,2026-03-16 21:20:25
d58df26e3d74,UFC Fight Night: Barboza vs. Chikadze,"August 28, 2021",2021-08-28,"Las Vegas, Nevada, USA",ufc,http://www.ufcstats.com/event-details/0db9d2486d564a3c,2026-03-16 21:20:25
bf07ca449e1d,UFC Fight Night: Cannonier vs. Gastelum,"August 21, 2021",2021-08-21,"Las Vegas, Nevada, USA",ufc,http://www.ufcstats.com/event-details/2f13e4020cea5b38,2026-03-16 21:20:25
5f42a99a568d,UFC 265: Lewis vs. Gane,"August 07, 2021",2021-08-07,"Houston, Texas, USA",ufc,http://www.ufcstats.com/event-details/972197a8c61ac413,2026-03-16 21:20:25
1bec2ab3e1de,UFC Fight Night: Hall vs. Strickland,"July 31, 2021",2021-07-31,"Las Vegas, Nevada, USA",ufc,http://www.ufcstats.com/event-details/320edfb0332b7073,2026-03-16 21:20:25
299591d513d8,UFC Fight Night: Sandhagen vs. Dillashaw,"July 24, 2021",2021-07-24,"Las Vegas, Nevada, USA",ufc,http://www.ufcstats.com/event-details/e57f0b06ea39e360,2026-03-16 21:20:25
2b5a9595b9cf,UFC Fight Night: Makhachev vs. Moises,"July 17, 2021",2021-07-17,"Las Vegas, Nevada, USA",ufc,http://www.ufcstats.com/event-details/40389d39a92f5bfa,2026-03-16 21:20:25
be1f0755701b,UFC 264: Poirier vs. McGregor 3,"July 10, 2021",2021-07-10,"Las Vegas, Nevada, USA",ufc,http://www.ufcstats.com/event-details/8a0be41c0380188d,2026-03-16 21:20:25
1b841ecda663,UFC Fight Night: Gane vs. Volkov,"June 26, 2021",2021-06-26,"Las Vegas, Nevada, USA",ufc,http://www.ufcstats.com/event-details/a1d6b308781aa2f5,2026-03-16 21:20:25
771e9201477f,UFC Fight Night: Jung vs. Ige,"June 19, 2021",2021-06-19,"Las Vegas, Nevada, USA",ufc,http://www.ufcstats.com/event-details/9ddfb3369a3b0394,2026-03-16 21:20:25
b1cd5f6fc6e7,UFC 263: Adesanya vs. Vettori 2,"June 12, 2021",2021-06-12,"Glendale, Arizona, USA",ufc,http://www.ufcstats.com/event-details/0b64d0fed453ef7f,2026-03-16 21:20:25
8003a11a654a,UFC Fight Night: Rozenstruik vs. Sakai,"June 05, 2021",2021-06-05,"Las Vegas, Nevada, USA",ufc,http://www.ufcstats.com/event-details/3b2485c8d5c8b580,2026-03-16 21:20:25
1cf10cf9b828,UFC Fight Night: Font vs. Garbrandt,"May 22, 2021",2021-05-22,"Las Vegas, Nevada, USA",ufc,http://www.ufcstats.com/event-details/277ffed20cf07aea,2026-03-16 21:20:25
02239c0c3158,UFC 262: Oliveira vs. Chandler,"May 15, 2021",2021-05-15,"Houston, Texas, USA",ufc,http://www.ufcstats.com/event-details/744f50016c39c26c,2026-03-16 21:20:25
23883081e9c2,UFC Fight Night: Rodriguez vs. Waterson,"May 08, 2021",2021-05-08,"Las Vegas, Nevada, USA",ufc,http://www.ufcstats.com/event-details/58a36b4ccf5dc30e,2026-03-16 21:20:25
a87d3d58d65d,UFC Fight Night: Reyes vs. Prochazka,"May 01, 2021",2021-05-01,"Las Vegas, Nevada, USA",ufc,http://www.ufcstats.com/event-details/d57e6a8971b6d2bd,2026-03-16 21:20:25
f9f13a82c957,UFC 261: Usman vs. Masvidal 2,"April 24, 2021",2021-04-24,"Jacksonville, Florida, USA",ufc,http://www.ufcstats.com/event-details/27541033b97c076d,2026-03-16 21:20:25
a9c0045e95fe,UFC Fight Night: Whittaker vs. Gastelum,"April 17, 2021",2021-04-17,"Las Vegas, Nevada, USA",ufc,http://www.ufcstats.com/event-details/4a35913bd9aa4161,2026-03-16 21:20:25
506db2b42a2d,UFC Fight Night: Vettori vs. Holland,"April 10, 2021",2021-04-10,"Las Vegas, Nevada, USA",ufc,http://www.ufcstats.com/event-details/9114c8ded5ccd71d,2026-03-16 21:20:25
f6161f8b84da,UFC 260: Miocic vs. Ngannou,"March 27, 2021",2021-03-27,"Las Vegas, Nevada, USA",ufc,http://www.ufcstats.com/event-details/6597b611f1c32555,2026-03-16 21:20:25
cb9d573e632e,UFC Fight Night: Brunson vs. Holland,"March 20, 2021",2021-03-20,"Las Vegas, Nevada, USA",ufc,http://www.ufcstats.com/event-details/c36e1f4fa755ffb4,2026-03-16 21:20:25
7ada5b17bb89,UFC Fight Night: Edwards vs. Muhammad,"March 13, 2021",2021-03-13,"Las Vegas, Nevada, USA",ufc,http://www.ufcstats.com/event-details/8c90c1563972e44d,2026-03-16 21:20:25
aa62f1ad5154,UFC 259: Blachowicz vs. Adesanya,"March 06, 2021",2021-03-06,"Las Vegas, Nevada, USA",ufc,http://www.ufcstats.com/event-details/6e2b1d631832921d,2026-03-16 21:20:25
e3cde83790a1,UFC Fight Night: Rozenstruik vs. Gane,"February 27, 2021",2021-02-27,"Las Vegas, Nevada, USA",ufc,http://www.ufcstats.com/event-details/81b57acd6975ac06,2026-03-16 21:20:25
3c9322a3224f,UFC Fight Night: Blaydes vs. Lewis,"February 20, 2021",2021-02-20,"Las Vegas, Nevada, USA",ufc,http://www.ufcstats.com/event-details/bfe95ec546692b13,2026-03-16 21:20:25
21f5372dc2ab,UFC 258: Usman vs. Burns,"February 13, 2021",2021-02-13,"Las Vegas, Nevada, USA",ufc,http://www.ufcstats.com/event-details/3f7c14c7eca7195d,2026-03-16 21:20:25
32a1ec546974,UFC Fight Night: Overeem vs. Volkov,"February 06, 2021",2021-02-06,"Las Vegas, Nevada, USA",ufc,http://www.ufcstats.com/event-details/a1153013cb5f628f,2026-03-16 21:20:25
d8a51819031b,UFC 257: Poirier vs. McGregor,"January 23, 2021",2021-01-23,"Abu Dhabi, Abu Dhabi, United Arab Emirates",ufc,http://www.ufcstats.com/event-details/4304992c2acc187b,2026-03-16 21:20:25
5772c5fc6aef,UFC Fight Night: Chiesa vs. Magny,"January 20, 2021",2021-01-20,"Abu Dhabi, Abu Dhabi, United Arab Emirates",ufc,http://www.ufcstats.com/event-details/56116537d71a578c,2026-03-16 21:20:25
3e5bb6c64dec,UFC Fight Night: Holloway vs. Kattar,"January 16, 2021",2021-01-16,"Abu Dhabi, Abu Dhabi, United Arab Emirates",ufc,http://www.ufcstats.com/event-details/307064d3e0f036c2,2026-03-16 21:20:25
daaaf9c4b8f7,UFC Fight Night: Thompson vs. Neal,"December 19, 2020",2020-12-19,"Las Vegas, Nevada, USA",ufc,http://www.ufcstats.com/event-details/e49c2db95e572dc8,2026-03-16 21:20:25
71590e47716b,UFC 256: Figueiredo vs. Moreno,"December 12, 2020",2020-12-12,"Las Vegas, Nevada, USA",ufc,http://www.ufcstats.com/event-details/d0d43cb9b14f231c,2026-03-16 21:20:25
8c7d3398a2d2,UFC Fight Night: Hermansson vs. Vettori,"December 05, 2020",2020-12-05,"Las Vegas, Nevada, USA",ufc,http://www.ufcstats.com/event-details/398b440e73d55b8b,2026-03-16 21:20:25
663d3f526573,UFC Fight Night: Smith vs. Clark,"November 28, 2020",2020-11-28,"Las Vegas, Nevada, USA",ufc,http://www.ufcstats.com/event-details/992c82450d96f726,2026-03-16 21:20:25
d8d56bb78e63,UFC 255: Figueiredo vs. Perez,"November 21, 2020",2020-11-21,"Las Vegas, Nevada, USA",ufc,http://www.ufcstats.com/event-details/bbb15f301e4a490a,2026-03-16 21:20:25
0b93e61e078c,UFC Fight Night: Felder vs. Dos Anjos,"November 14, 2020",2020-11-14,"Las Vegas, Nevada, USA",ufc,http://www.ufcstats.com/event-details/3bc27ec15facbcf3,2026-03-16 21:20:25
0f0265d1b91e,UFC Fight Night: Santos vs. Teixeira,"November 07, 2020",2020-11-07,"Las Vegas, Nevada, USA",ufc,http://www.ufcstats.com/event-details/41dca66f9dadfc86,2026-03-16 21:20:25
0ac985deb985,UFC Fight Night: Hall vs. Silva,"October 31, 2020",2020-10-31,"Las Vegas, Nevada, USA",ufc,http://www.ufcstats.com/event-details/ad044be25c94dcfd,2026-03-16 21:20:25
bbf38c1b384c,UFC 254: Khabib vs. Gaethje,"October 24, 2020",2020-10-24,"Abu Dhabi, Abu Dhabi, United Arab Emirates",ufc,http://www.ufcstats.com/event-details/c3c38c86f5ab9b5c,2026-03-16 21:20:25
27f616765eb0,UFC Fight Night: Ortega vs. The Korean Zombie,"October 17, 2020",2020-10-17,"Abu Dhabi, Abu Dhabi, United Arab Emirates",ufc,http://www.ufcstats.com/event-details/d4f364dd076bb0e2,2026-03-16 21:20:25
d1c0374fff9e,UFC Fight Night: Moraes vs. Sandhagen,"October 10, 2020",2020-10-10,"Abu Dhabi, Abu Dhabi, United Arab Emirates",ufc,http://www.ufcstats.com/event-details/fd4578cac86d75ca,2026-03-16 21:20:25
3c41aba3318f,UFC Fight Night: Holm vs. Aldana,"October 03, 2020",2020-10-03,"Abu Dhabi, Abu Dhabi, United Arab Emirates",ufc,http://www.ufcstats.com/event-details/805ad1801eb26abb,2026-03-16 21:20:25
728819c51e89,UFC 253: Adesanya vs. Costa,"September 26, 2020",2020-09-26,"Abu Dhabi, Abu Dhabi, United Arab Emirates",ufc,http://www.ufcstats.com/event-details/e69c5ce12f4e762b,2026-03-16 21:20:25
fe689a9b08df,UFC Fight Night: Covington vs. Woodley,"September 19, 2020",2020-09-19,"Las Vegas, Nevada, USA",ufc,http://www.ufcstats.com/event-details/831b937811804dad,2026-03-16 21:20:25
1ab986a7ae40,UFC Fight Night: Waterson vs. Hill,"September 12, 2020",2020-09-12,"Las Vegas, Nevada, USA",ufc,http://www.ufcstats.com/event-details/9c37681096c6f3a9,2026-03-16 21:20:25
8f1e691fd674,UFC Fight Night: Overeem vs. Sakai,"September 05, 2020",2020-09-05,"Las Vegas, Nevada, USA",ufc,http://www.ufcstats.com/event-details/542db012217ecb83,2026-03-16 21:20:25
7bf43659b2c7,UFC Fight Night: Smith vs. Rakic,"August 29, 2020",2020-08-29,"Las Vegas, Nevada, USA",ufc,http://www.ufcstats.com/event-details/e29cf523ebd155c5,2026-03-16 21:20:25
1bcd3748819e,UFC Fight Night: Munhoz vs. Edgar,"August 22, 2020",2020-08-22,"Las Vegas, Nevada, USA",ufc,http://www.ufcstats.com/event-details/af1e5c64b8663aa0,2026-03-16 21:20:25
7debc9a433ad,UFC 252: Miocic vs. Cormier 3,"August 15, 2020",2020-08-15,"Las Vegas, Nevada, USA",ufc,http://www.ufcstats.com/event-details/bda04c573563cc2e,2026-03-16 21:20:25
263681d79e64,UFC Fight Night: Lewis vs. Oleinik,"August 08, 2020",2020-08-08,"Las Vegas, Nevada, USA",ufc,http://www.ufcstats.com/event-details/7a82635ffa9b59fe,2026-03-16 21:20:25
c3e4ac979cc3,UFC Fight Night: Brunson vs. Shahbazyan,"August 01, 2020",2020-08-01,"Las Vegas, Nevada, USA",ufc,http://www.ufcstats.com/event-details/3746e21bb508391a,2026-03-16 21:20:25
5aec153cc381,UFC Fight Night: Whittaker vs. Till,"July 25, 2020",2020-07-25,"Abu Dhabi, Abu Dhabi, United Arab Emirates",ufc,http://www.ufcstats.com/event-details/dde70a112e053a6c,2026-03-16 21:20:25
23a52882c824,UFC Fight Night: Figueiredo vs. Benavidez 2,"July 18, 2020",2020-07-18,"Abu Dhabi, Abu Dhabi, United Arab Emirates",ufc,http://www.ufcstats.com/event-details/ddbd0d6259ce57cc,2026-03-16 21:20:25
f76fdf5e4d12,UFC Fight Night: Kattar vs. Ige,"July 15, 2020",2020-07-15,"Abu Dhabi, Abu Dhabi, United Arab Emirates",ufc,http://www.ufcstats.com/event-details/18f5669a92e99d92,2026-03-16 21:20:25
c47a2da58c44,UFC 251: Usman vs. Masvidal,"July 11, 2020",2020-07-11,"Abu Dhabi, Abu Dhabi, United Arab Emirates",ufc,http://www.ufcstats.com/event-details/dbd198f780286aca,2026-03-16 21:20:25
57de69b6f038,UFC Fight Night: Poirier vs. Hooker,"June 27, 2020",2020-06-27,"Las Vegas, Nevada, USA",ufc,http://www.ufcstats.com/event-details/c32eab6c2119e989,2026-03-16 21:20:25
b411b58b52a9,UFC Fight Night: Blaydes vs. Volkov,"June 20, 2020",2020-06-20,"Las Vegas, Nevada, USA",ufc,http://www.ufcstats.com/event-details/2eab7a6c8b0ed8cc,2026-03-16 21:20:25
93b769710502,UFC Fight Night: Eye vs. Calvillo,"June 13, 2020",2020-06-13,"Las Vegas, Nevada, USA",ufc,http://www.ufcstats.com/event-details/1e13936d708bcff7,2026-03-16 21:20:25
1b26ba1c01cc,UFC 250: Nunes vs. Spencer,"June 06, 2020",2020-06-06,"Las Vegas, Nevada, USA",ufc,http://www.ufcstats.com/event-details/4c12aa7ca246e7a4,2026-03-16 21:20:25
50dc7e46d5bd,UFC Fight Night: Woodley vs. Burns,"May 30, 2020",2020-05-30,"Las Vegas, Nevada, USA",ufc,http://www.ufcstats.com/event-details/14b9e0f2679a2205,2026-03-16 21:20:25
625b9f47463a,UFC Fight Night: Overeem vs. Harris,"May 16, 2020",2020-05-16,"Jacksonville, Florida, USA",ufc,http://www.ufcstats.com/event-details/dfb965c9824425db,2026-03-16 21:20:25
19d56f26c3af,UFC Fight Night: Smith vs. Teixeira,"May 13, 2020",2020-05-13,"Jacksonville, Florida, USA",ufc,http://www.ufcstats.com/event-details/5f8e00c27b7e7410,2026-03-16 21:20:25
901aeafe7992,UFC 249: Ferguson vs. Gaethje,"May 09, 2020",2020-05-09,"Jacksonville, Florida, USA",ufc,http://www.ufcstats.com/event-details/898337ef520fe4d3,2026-03-16 21:20:25
098b46adff77,UFC Fight Night: Lee vs. Oliveira,"March 14, 2020",2020-03-14,"Brasilia, Distrito Federal, Brazil",ufc,http://www.ufcstats.com/event-details/53278852bcd91e11,2026-03-16 21:20:25
629f74c3dd3e,UFC 248: Adesanya vs. Romero,"March 07, 2020",2020-03-07,"Las Vegas, Nevada, USA",ufc,http://www.ufcstats.com/event-details/0b5b6876c2a4723f,2026-03-16 21:20:25
1e45376090f6,UFC Fight Night: Benavidez vs. Figueiredo,"February 29, 2020",2020-02-29,"Norfolk, Virginia, USA",ufc,http://www.ufcstats.com/event-details/fc9a9559a05f2704,2026-03-16 21:20:25
662becc865e5,UFC Fight Night: Felder vs. Hooker,"February 22, 2020",2020-02-22,"Auckland, New Zealand",ufc,http://www.ufcstats.com/event-details/33b2f68ef95252e0,2026-03-16 21:20:25
8cee483c6d3d,UFC Fight Night: Anderson vs. Blachowicz,"February 15, 2020",2020-02-15,"Rio Rancho, New Mexico, USA",ufc,http://www.ufcstats.com/event-details/5df17b3620145578,2026-03-16 21:20:25
b4292716d700,UFC 247: Jones vs. Reyes,"February 08, 2020",2020-02-08,"Houston, Texas, USA",ufc,http://www.ufcstats.com/event-details/b26d3e3746fb4024,2026-03-16 21:20:25
add2d2096020,UFC Fight Night: Blaydes vs. Dos Santos,"January 25, 2020",2020-01-25,"Raleigh, North Carolina, USA",ufc,http://www.ufcstats.com/event-details/44aa652b181bcf68,2026-03-16 21:20:25
0f5858a4b176,UFC 246: McGregor vs. Cowboy,"January 18, 2020",2020-01-18,"Las Vegas, Nevada, USA",ufc,http://www.ufcstats.com/event-details/0c1773639c795466,2026-03-16 21:20:25
809880ac6cae,UFC Fight Night: Edgar vs. The Korean Zombie,"December 21, 2019",2019-12-21,"Busan, South Korea",ufc,http://www.ufcstats.com/event-details/74fefd43f073cd2f,2026-03-16 21:20:25
42dd4e5f0e1b,UFC 245: Usman vs. Covington,"December 14, 2019",2019-12-14,"Las Vegas, Nevada, USA",ufc,http://www.ufcstats.com/event-details/4565d435005319c0,2026-03-16 21:20:25
e1ca259413f4,UFC Fight Night: Overeem vs. Rozenstruik,"December 07, 2019",2019-12-07,"Washington, DC, USA",ufc,http://www.ufcstats.com/event-details/b09890ba7ce1d1e2,2026-03-16 21:20:25
095836ebac4a,UFC Fight Night: Blachowicz vs. Jacare,"November 16, 2019",2019-11-16,"Sao Paulo, Sao Paulo, Brazil",ufc,http://www.ufcstats.com/event-details/81ca2c245b19b3c5,2026-03-16 21:20:25
733f8ca2284d,UFC Fight Night: Zabit vs. Kattar,"November 09, 2019",2019-11-09,"Moscow, Moscow, Russia",ufc,http://www.ufcstats.com/event-details/8d5daf67983b65ba,2026-03-16 21:20:25
4e23fe7a0d08,UFC 244: Masvidal vs. Diaz,"November 02, 2019",2019-11-02,"New York City, New York, USA",ufc,http://www.ufcstats.com/event-details/fd87b1bbfcde9d5e,2026-03-16 21:20:25
10288cec7a7f,UFC Fight Night: Maia vs. Askren,"October 26, 2019",2019-10-26,"Kallang, Singapore",ufc,http://www.ufcstats.com/event-details/df05aa15b2d66f57,2026-03-16 21:20:25
c57e30d21a86,UFC Fight Night: Reyes vs. Weidman,"October 18, 2019",2019-10-18,"Boston, Massachusetts, USA",ufc,http://www.ufcstats.com/event-details/3ae10ac4df3df05c,2026-03-16 21:20:25
09454a136031,UFC Fight Night: Joanna vs. Waterson,"October 12, 2019",2019-10-12,"Tampa, Florida, USA",ufc,http://www.ufcstats.com/event-details/0941df56f6ac954b,2026-03-16 21:20:25
5d8325a63e31,UFC 243: Whittaker vs. Adesanya,"October 05, 2019",2019-10-05,"Melbourne, Victoria, Australia",ufc,http://www.ufcstats.com/event-details/3cf68c1d17f66af7,2026-03-16 21:20:25
2c2a119c1b77,UFC Fight Night: Hermansson vs. Cannonier,"September 28, 2019",2019-09-28,"Copenhagen, Denmark",ufc,http://www.ufcstats.com/event-details/1bf49bf829964144,2026-03-16 21:20:25
15cee339157d,UFC Fight Night: Rodriguez vs. Stephens,"September 21, 2019",2019-09-21,"Mexico City, Distrito Federal, Mexico",ufc,http://www.ufcstats.com/event-details/94a5aaf573f780ad,2026-03-16 21:20:25
36c268824292,UFC Fight Night: Cowboy vs. Gaethje,"September 14, 2019",2019-09-14,"Vancouver, British Columbia, Canada",ufc,http://www.ufcstats.com/event-details/4834ff149dc9542a,2026-03-16 21:20:25
258e04bb2f39,UFC 242: Khabib vs. Poirier,"September 07, 2019",2019-09-07,"Abu Dhabi, Abu Dhabi, United Arab Emirates",ufc,http://www.ufcstats.com/event-details/a79bfbc01b2264d6,2026-03-16 21:20:25
dba511de7464,UFC Fight Night: Andrade vs. Zhang,"August 31, 2019",2019-08-31,"Shenzhen, Guangdong, China",ufc,http://www.ufcstats.com/event-details/2c104b7e59a72629,2026-03-16 21:20:25
7f922d50ce0d,UFC 241: Cormier vs. Miocic 2,"August 17, 2019",2019-08-17,"Anaheim, California, USA",ufc,http://www.ufcstats.com/event-details/70167689d6a01793,2026-03-16 21:20:25
867fdee96122,UFC Fight Night: Shevchenko vs. Carmouche 2,"August 10, 2019",2019-08-10,"Montevideo, Uruguay",ufc,http://www.ufcstats.com/event-details/e5d03e4d966126bd,2026-03-16 21:20:25
573ef931da84,UFC Fight Night: Covington vs. Lawler,"August 03, 2019",2019-08-03,"Newark, New Jersey, USA",ufc,http://www.ufcstats.com/event-details/03da33a102d9a45f,2026-03-16 21:20:25
360ac43f84b8,UFC 240: Holloway vs. Edgar,"July 27, 2019",2019-07-27,"Edmonton, Alberta, Canada",ufc,http://www.ufcstats.com/event-details/abcf7e55a0a9ed89,2026-03-16 21:20:25
b025f2ca0a1a,UFC Fight Night: Dos Anjos vs. Edwards,"July 20, 2019",2019-07-20,"San Antonio, Texas, USA",ufc,http://www.ufcstats.com/event-details/9e0f28d1f639ad73,2026-03-16 21:20:25
