event_id,name,date,date_parsed,location,org_id,url,created_at
eca76ae5767e,UFC Fight Night: De Randamie vs. Ladd,"July 13, 2019",2019-07-13,"Sacramento, California, USA",ufc,http://www.ufcstats.com/event-details/2f8f3c69522db931,2026-03-16 21:20:25
161d7a10c434,UFC 239: Jones vs. Santos,"July 06, 2019",2019-07-06,"Las Vegas, Nevada, USA",ufc,http://www.ufcstats.com/event-details/6c9383ffab2725a5,2026-03-16 21:20:25
b9c8f546b9a8,UFC Fight Night: Ngannou vs. Dos Santos,"June 29, 2019",2019-06-29,"Minneapolis, Minnesota, USA",ufc,http://www.ufcstats.com/event-details/c0c1bc0766df4c00,2026-03-16 21:20:25
14b5e7e1885f,UFC Fight Night: Moicano vs. The Korean Zombie,"June 22, 2019",2019-06-22,"Greenville, South Carolina, USA",ufc,http://www.ufcstats.com/event-details/b16a7e6a627e9789,2026-03-16 21:20:25
229a51add473,UFC 238: Cejudo vs. Moraes,"June 08, 2019",2019-06-08,"Chicago, Illinois, USA",ufc,http://www.ufcstats.com/event-details/e31502e3f79d00c5,2026-03-16 21:20:25
a696d5d60921,UFC Fight Night: Gustafsson vs. Smith,"June 01, 2019",2019-06-01,"Stockholm, Sweden",ufc,http://www.ufcstats.com/event-details/cbc071cb20ea59c7,2026-03-16 21:20:25
7ee3c14a8cb4,UFC Fight Night: Dos Anjos vs. Lee,"May 18, 2019",2019-05-18,"Rochester, New York, USA",ufc,http://www.ufcstats.com/event-details/6b8f28da9a483049,2026-03-16 21:20:25
44ff2d8bc613,UFC 237: Namajunas vs. Andrade,"May 11, 2019",2019-05-11,"Rio de Janeiro, Rio de Janeiro, Brazil",ufc,http://www.ufcstats.com/event-details/9de7c97e1c0d7927,2026-03-16 21:20:25
df3c94755e3e,UFC Fight Night: Iaquinta vs. Cowboy,"May 04, 2019",2019-05-04,"Ottawa, Ontario, Canada",ufc,http://www.ufcstats.com/event-details/351264d11286d09a,2026-03-16 21:20:25
c84f9d6bb8f8,UFC Fight Night: Jacare vs. Hermansson,"April 27, 2019",2019-04-27,"Sunrise, Florida, USA",ufc,http://www.ufcstats.com/event-details/c912f676692c353a,2026-03-16 21:20:25
5c082a35e61e,UFC Fight Night: Overeem vs. Oleinik,"April 20, 2019",2019-04-20,"Saint Petersburg, Saint Petersburg, Russia",ufc,http://www.ufcstats.com/event-details/7dcf06c1967801c1,2026-03-16 21:20:25
3ce068640de3,UFC 236: Holloway vs. Poirier 2,"April 13, 2019",2019-04-13,"Atlanta, Georgia, USA",ufc,http://www.ufcstats.com/event-details/b0550072e5f0afa7,2026-03-16 21:20:25
e667770ba626,UFC Fight Night: Barboza vs. Gaethje,"March 30, 2019",2019-03-30,"Philadelphia, Pennsylvania, USA",ufc,http://www.ufcstats.com/event-details/9649d75defe0dedb,2026-03-16 21:20:25
4b19df9b2002,UFC Fight Night: Thompson vs. Pettis,"March 23, 2019",2019-03-23,"Nashville, Tennessee, USA",ufc,http://www.ufcstats.com/event-details/487c170da059857d,2026-03-16 21:20:25
f03040aa4f83,UFC Fight Night: Till vs. Masvidal,"March 16, 2019",2019-03-16,"London, England, United Kingdom",ufc,http://www.ufcstats.com/event-details/80eacd4da0617c57,2026-03-16 21:20:25
cdb8578b90ca,UFC Fight Night: Lewis vs. Dos Santos,"March 09, 2019",2019-03-09,"Wichita, Kansas, USA",ufc,http://www.ufcstats.com/event-details/e96d8538d3f9d0ed,2026-03-16 21:20:25
96a7567c60db,UFC 235: Jones vs. Smith,"March 02, 2019",2019-03-02,"Las Vegas, Nevada, USA",ufc,http://www.ufcstats.com/event-details/2d5fbe2103f97053,2026-03-16 21:20:25
1f010d8926e3,UFC Fight Night: Blachowicz vs. Santos,"February 23, 2019",2019-02-23,"Prague, Czech Republic",ufc,http://www.ufcstats.com/event-details/6546af7ab545b90c,2026-03-16 21:20:25
1203e2a53ea4,UFC Fight Night: Ngannou vs. Velasquez,"February 17, 2019",2019-02-17,"Phoenix, Arizona, USA",ufc,http://www.ufcstats.com/event-details/a7a79b8efbceaaac,2026-03-16 21:20:25
199fb0cf20bd,UFC 234: Adesanya vs. Silva,"February 09, 2019",2019-02-09,"Melbourne, Victoria, Australia",ufc,http://www.ufcstats.com/event-details/b5882371e2a3900d,2026-03-16 21:20:25
29e5c9bd2c70,UFC Fight Night: Assuncao vs. Moraes 2,"February 02, 2019",2019-02-02,"Fortaleza, Ceara, Brazil",ufc,http://www.ufcstats.com/event-details/84283233ec42be5f,2026-03-16 21:20:25
70587e69c82c,UFC Fight Night: Cejudo vs. Dillashaw,"January 19, 2019",2019-01-19,"Brooklyn, New York, USA",ufc,http://www.ufcstats.com/event-details/d4da8995fc91e7ef,2026-03-16 21:20:25
138b5238ae72,UFC 232: Jones vs. Gustafsson 2,"December 29, 2018",2018-12-29,"Los Angeles, California, USA",ufc,http://www.ufcstats.com/event-details/c046100aea0dba9a,2026-03-16 21:20:25
f0d100812fd8,UFC Fight Night: Lee vs. Iaquinta,"December 15, 2018",2018-12-15,"Milwaukee, Wisconsin, USA",ufc,http://www.ufcstats.com/event-details/7a703c565ccaa18f,2026-03-16 21:20:25
fc5ba286720d,UFC 231: Holloway vs. Ortega,"December 08, 2018",2018-12-08,"Toronto, Ontario, Canada",ufc,http://www.ufcstats.com/event-details/2a74bbba57058f12,2026-03-16 21:20:25
59674ec729e5,UFC Fight Night: Dos Santos vs. Tuivasa,"December 01, 2018",2018-12-01,"Adelaide, South Australia, Australia",ufc,http://www.ufcstats.com/event-details/d1d20e651e6cbc02,2026-03-16 21:20:25
cff6edb30c9f,The Ultimate Fighter: Heavy Hitters Finale,"November 30, 2018",2018-11-30,"Las Vegas, Nevada, USA",ufc,http://www.ufcstats.com/event-details/c7ac79839e86ce33,2026-03-16 21:20:25
df7b08803059,UFC Fight Night: Blaydes vs. Ngannou 2,"November 24, 2018",2018-11-24,"Beijing, China",ufc,http://www.ufcstats.com/event-details/de25520d54eab12d,2026-03-16 21:20:25
bee261f64a98,UFC Fight Night: Magny vs. Ponzinibbio,"November 17, 2018",2018-11-17,"Buenos Aires, Buenos Aires, Argentina",ufc,http://www.ufcstats.com/event-details/aa3153a9941b4d44,2026-03-16 21:20:25
155355b92f0e,UFC Fight Night: Korean Zombie vs. Rodriguez,"November 10, 2018",2018-11-10,"Denver, Colorado, USA",ufc,http://www.ufcstats.com/event-details/42c96a9c4802e2e1,2026-03-16 21:20:25
0e6b17e245ad,UFC 230: Cormier vs. Lewis,"November 03, 2018",2018-11-03,"New York City, New York, USA",ufc,http://www.ufcstats.com/event-details/20821819c401ced8,2026-03-16 21:20:25
9ef3bef451fe,UFC Fight Night: Oezdemir vs. Smith,"October 27, 2018",2018-10-27,"Moncton, New Brunswick, Canada",ufc,http://www.ufcstats.com/event-details/33a331684283900f,2026-03-16 21:20:25
dac3f03067ea,UFC 229: Khabib vs. McGregor,"October 06, 2018",2018-10-06,"Las Vegas, Nevada, USA",ufc,http://www.ufcstats.com/event-details/1ef0eae31904e534,2026-03-16 21:20:25
99182b40c0b5,UFC Fight Night: Marreta vs. Anders,"September 22, 2018",2018-09-22,"Sao Paulo, Sao Paulo, Brazil",ufc,http://www.ufcstats.com/event-details/852454c572675334,2026-03-16 21:20:25
e657267dc9ee,UFC Fight Night: Hunt vs. Oleinik,"September 15, 2018",2018-09-15,"Moscow, Moscow, Russia",ufc,http://www.ufcstats.com/event-details/8d49545dadf9b919,2026-03-16 21:20:25
6f892beb4f4c,UFC 228: Woodley vs. Till,"September 08, 2018",2018-09-08,"Dallas, Texas, USA",ufc,http://www.ufcstats.com/event-details/d5ae8074631762fc,2026-03-16 21:20:25
b9e9db8852b9,UFC Fight Night: Gaethje vs. Vick,"August 25, 2018",2018-08-25,"Lincoln, Nebraska, USA",ufc,http://www.ufcstats.com/event-details/c0342805a1948cbb,2026-03-16 21:20:25
fd1a45820d2d,UFC 227: Dillashaw vs. Garbrandt 2,"August 04, 2018",2018-08-04,"Los Angeles, California, USA",ufc,http://www.ufcstats.com/event-details/03b1e846b09f721d,2026-03-16 21:20:25
edf05585c61f,UFC Fight Night: Alvarez vs. Poirier 2,"July 28, 2018",2018-07-28,"Calgary, Alberta, Canada",ufc,http://www.ufcstats.com/event-details/322a56923b396b4d,2026-03-16 21:20:25
1c2a2398cc26,UFC Fight Night: Shogun vs. Smith,"July 22, 2018",2018-07-22,"Hamburg, Hamburg, Germany",ufc,http://www.ufcstats.com/event-details/4f732e58ed907eff,2026-03-16 21:20:25
cb0003623b39,UFC Fight Night: Dos Santos vs. Ivanov,"July 14, 2018",2018-07-14,"Boise, Idaho, USA",ufc,http://www.ufcstats.com/event-details/b45d6b73f4ca4467,2026-03-16 21:20:25
014d62040ab7,UFC 226: Miocic vs. Cormier,"July 07, 2018",2018-07-07,"Las Vegas, Nevada, USA",ufc,http://www.ufcstats.com/event-details/35585d970300d45a,2026-03-16 21:20:25
2925d80df0c6,The Ultimate Fighter: Undefeated Finale,"July 06, 2018",2018-07-06,"Las Vegas, Nevada, USA",ufc,http://www.ufcstats.com/event-details/8215e4fe24e8e81b,2026-03-16 21:20:25
e7c89164db64,UFC Fight Night: Cowboy vs. Edwards,"June 23, 2018",2018-06-23,"Kallang, Singapore",ufc,http://www.ufcstats.com/event-details/ac5f67109accb482,2026-03-16 21:20:25
c47ed4ee61ab,UFC 225: Whittaker vs. Romero 2,"June 09, 2018",2018-06-09,"Chicago, Illinois, USA",ufc,http://www.ufcstats.com/event-details/2eae41f61776c60f,2026-03-16 21:20:25
7ec98160ef74,UFC Fight Night: Rivera vs. Moraes,"June 01, 2018",2018-06-01,"Utica, New York, USA",ufc,http://www.ufcstats.com/event-details/d29b5c4f22c6357d,2026-03-16 21:20:25
cf64ab445521,UFC Fight Night: Thompson vs. Till,"May 27, 2018",2018-05-27,"Liverpool, England, United Kingdom",ufc,http://www.ufcstats.com/event-details/f5990c11974d8e9c,2026-03-16 21:20:25
e84454204384,UFC Fight Night: Maia vs. Usman,"May 19, 2018",2018-05-19,"Santiago, Chile",ufc,http://www.ufcstats.com/event-details/3144121470023e9a,2026-03-16 21:20:25
c1e562e5d53a,UFC 224: Nunes vs. Pennington,"May 12, 2018",2018-05-12,"Rio de Janeiro, Rio de Janeiro, Brazil",ufc,http://www.ufcstats.com/event-details/67ec58d7cf599835,2026-03-16 21:20:25
7e95bd1bb041,UFC Fight Night: Barboza vs. Lee,"April 21, 2018",2018-04-21,"Atlantic City, New Jersey, USA",ufc,http://www.ufcstats.com/event-details/ad99fa5325519169,2026-03-16 21:20:25
ce404890d086,UFC Fight Night: Poirier vs. Gaethje,"April 14, 2018",2018-04-14,"Glendale, Arizona, USA",ufc,http://www.ufcstats.com/event-details/620be7e0712d431b,2026-03-16 21:20:25
3b9d8d85c2ac,UFC 223: Khabib vs. Iaquinta,"April 07, 2018",2018-04-07,"Brooklyn, New York, USA",ufc,http://www.ufcstats.com/event-details/49e7e05f902479ca,2026-03-16 21:20:25
2f68eb816200,UFC Fight Night: Werdum vs. Volkov,"March 17, 2018",2018-03-17,"London, England, United Kingdom",ufc,http://www.ufcstats.com/event-details/eed2b71d77d95416,2026-03-16 21:20:25
024b25dc790b,UFC 222: Cyborg vs. Kunitskaya,"March 03, 2018",2018-03-03,"Las Vegas, Nevada, USA",ufc,http://www.ufcstats.com/event-details/7929be8290289a47,2026-03-16 21:20:25
13f9ca6bce3b,UFC Fight Night: Emmett vs. Stephens,"February 24, 2018",2018-02-24,"Orlando, Florida, USA",ufc,http://www.ufcstats.com/event-details/daa89f01e1c0f42a,2026-03-16 21:20:25
bddc3ce546d7,UFC Fight Night: Cerrone vs. Medeiros,"February 18, 2018",2018-02-18,"Austin, Texas, USA",ufc,http://www.ufcstats.com/event-details/d181689653115b6a,2026-03-16 21:20:25
9559b342e93f,UFC 221: Romero vs. Rockhold,"February 10, 2018",2018-02-10,"Perth, Western Australia, Australia",ufc,http://www.ufcstats.com/event-details/15515e797aedc137,2026-03-16 21:20:25
dfcd6b4c0173,UFC Fight Night: Machida vs. Anders,"February 03, 2018",2018-02-03,"Belem, Para, Brazil",ufc,http://www.ufcstats.com/event-details/7cf20446453f852b,2026-03-16 21:20:25
b0310268c7cc,UFC Fight Night: Jacare vs. Brunson 2,"January 27, 2018",2018-01-27,"Charlotte, North Carolina, USA",ufc,http://www.ufcstats.com/event-details/602bb270f2bdbf02,2026-03-16 21:20:25
a376cd8289a1,UFC 220: Miocic vs. Ngannou,"January 20, 2018",2018-01-20,"Boston, Massachusetts, USA",ufc,http://www.ufcstats.com/event-details/02177caefe7c07d4,2026-03-16 21:20:25
08b910a64fec,UFC Fight Night: Stephens vs. Choi,"January 14, 2018",2018-01-14,"St. Louis, Missouri, USA",ufc,http://www.ufcstats.com/event-details/fc1868f56d3036eb,2026-03-16 21:20:25
b1eaa6382639,UFC 219: Cyborg vs. Holm,"December 30, 2017",2017-12-30,"Las Vegas, Nevada, USA",ufc,http://www.ufcstats.com/event-details/04076783ca83d6ae,2026-03-16 21:20:25
d5723561c308,UFC Fight Night: Lawler vs. Dos Anjos,"December 16, 2017",2017-12-16,"Winnipeg, Manitoba, Canada",ufc,http://www.ufcstats.com/event-details/eaa0a728cc91ef60,2026-03-16 21:20:25
b6979c3fe194,UFC Fight Night: Swanson vs. Ortega,"December 09, 2017",2017-12-09,"Fresno, California, USA",ufc,http://www.ufcstats.com/event-details/bcd124bcd3d5be46,2026-03-16 21:20:25
48791198b223,UFC 218: Holloway vs. Aldo 2,"December 02, 2017",2017-12-02,"Detroit, Michigan, USA",ufc,http://www.ufcstats.com/event-details/9e30f69cc0869301,2026-03-16 21:20:25
ffce0efbef81,The Ultimate Fighter: A New World Champion Finale,"December 01, 2017",2017-12-01,"Las Vegas, Nevada, USA",ufc,http://www.ufcstats.com/event-details/30e8b4505f5ccf92,2026-03-16 21:20:25
88dd00aadd12,UFC Fight Night: Bisping vs. Gastelum,"November 25, 2017",2017-11-25,"Shanghai, Hebei, China",ufc,http://www.ufcstats.com/event-details/e7bc606d269896aa,2026-03-16 21:20:25
b30ea592fcc5,UFC Fight Night: Werdum vs. Tybura,"November 18, 2017",2017-11-18,"Sydney, New South Wales, Australia",ufc,http://www.ufcstats.com/event-details/caced97768818230,2026-03-16 21:20:25
8d8973ecf8aa,UFC Fight Night: Poirier vs. Pettis,"November 11, 2017",2017-11-11,"Norfolk, Virginia, USA",ufc,http://www.ufcstats.com/event-details/d856a0080ac09ed7,2026-03-16 21:20:25
b64c3a1787b4,UFC 217: Bisping vs. St-Pierre,"November 04, 2017",2017-11-04,"New York City, New York, USA",ufc,http://www.ufcstats.com/event-details/a25b71fe5e31fa97,2026-03-16 21:20:25
b66069fdcfb7,UFC Fight Night: Brunson vs. Machida,"October 28, 2017",2017-10-28,"Sao Paulo, Sao Paulo, Brazil",ufc,http://www.ufcstats.com/event-details/a7724f51e32e763e,2026-03-16 21:20:25
2acbd547f1e8,UFC Fight Night: Cerrone vs. Till,"October 21, 2017",2017-10-21,"Gdansk, Poland",ufc,http://www.ufcstats.com/event-details/d6b68eaf4b68b160,2026-03-16 21:20:25
fd560406f487,UFC 216: Ferguson vs. Lee,"October 07, 2017",2017-10-07,"Las Vegas, Nevada, USA",ufc,http://www.ufcstats.com/event-details/cc5834a495d1ea08,2026-03-16 21:20:25
157e86758e92,UFC Fight Night: Saint Preux vs. Okami,"September 22, 2017",2017-09-22,"Saitama, Saitama, Japan",ufc,http://www.ufcstats.com/event-details/9211aae062b799d6,2026-03-16 21:20:25
96e607c4da27,UFC Fight Night: Rockhold vs. Branch,"September 16, 2017",2017-09-16,"Pittsburgh, Pennsylvania, USA",ufc,http://www.ufcstats.com/event-details/1979c80150f630c4,2026-03-16 21:20:25
3a70f2f80873,UFC 215: Nunes vs Shevchenko 2,"September 09, 2017",2017-09-09,"Edmonton, Alberta, Canada",ufc,http://www.ufcstats.com/event-details/d86e913c548c07c2,2026-03-16 21:20:25
5756164ad394,UFC Fight Night: Volkov vs. Struve,"September 02, 2017",2017-09-02,"Rotterdam, Zuid-Holland, Netherlands",ufc,http://www.ufcstats.com/event-details/a3244e3238541482,2026-03-16 21:20:25
6299cd00c867,UFC Fight Night: Pettis vs. Moreno,"August 05, 2017",2017-08-05,"Mexico City, Distrito Federal, Mexico",ufc,http://www.ufcstats.com/event-details/f4a031ac205ac580,2026-03-16 21:20:25
2b063aa7cb33,UFC 214: Cormier vs. Jones 2,"July 29, 2017",2017-07-29,"Anaheim, California, USA",ufc,http://www.ufcstats.com/event-details/ff9578cdbfabd323,2026-03-16 21:20:25
239d1852c41c,UFC Fight Night: Weidman vs. Gastelum,"July 22, 2017",2017-07-22,"Uniondale, New York, USA",ufc,http://www.ufcstats.com/event-details/9f3d6ddef3d3cccc,2026-03-16 21:20:25
0338d1ea78f9,UFC Fight Night: Nelson vs. Ponzinibbio,"July 16, 2017",2017-07-16,"Glasgow, Scotland, United Kingdom",ufc,http://www.ufcstats.com/event-details/d7907a9a968e4d29,2026-03-16 21:20:25
992b975f7052,UFC 213: Romero vs. Whittaker,"July 08, 2017",2017-07-08,"Las Vegas, Nevada, USA",ufc,http://www.ufcstats.com/event-details/686cccbf1a4de453,2026-03-16 21:20:25
9d14e0de3ba4,The Ultimate Fighter: Redemption Finale,"July 07, 2017",2017-07-07,"Las Vegas, Nevada, USA",ufc,http://www.ufcstats.com/event-details/23bd78c3f89bdb54,2026-03-16 21:20:25
faafa0ce541d,UFC Fight Night: Chiesa vs. Lee,"June 25, 2017",2017-06-25,"Oklahoma City, Oklahoma, USA",ufc,http://www.ufcstats.com/event-details/99bf06f20491cb54,2026-03-16 21:20:25
c1027ef7e4d4,UFC Fight Night: Holm vs. Correia,"June 17, 2017",2017-06-17,"Kallang, Singapore",ufc,http://www.ufcstats.com/event-details/353de740bb6c7e75,2026-03-16 21:20:25
50cb157bc73e,UFC Fight Night: Lewis vs. Hunt,"June 10, 2017",2017-06-10,"Auckland, New Zealand",ufc,http://www.ufcstats.com/event-details/90e7447d8b7f3f35,2026-03-16 21:20:25
75484e0335bc,UFC 212: Aldo vs. Holloway,"June 03, 2017",2017-06-03,"Rio de Janeiro, Rio de Janeiro, Brazil",ufc,http://www.ufcstats.com/event-details/1507214bbc7a79e2,2026-03-16 21:20:25
869dfd23f86e,UFC Fight Night: Gustafsson vs. Teixeira,"May 28, 2017",2017-05-28,"Stockholm, Sweden",ufc,http://www.ufcstats.com/event-details/1c7cce2f5c17160d,2026-03-16 21:20:25
c4fefe05d2d4,UFC 211: Miocic vs. Dos Santos,"May 13, 2017",2017-05-13,"Dallas, Texas, USA",ufc,http://www.ufcstats.com/event-details/5df10509264586e5,2026-03-16 21:20:25
54b13d3ad1fa,UFC Fight Night: Swanson vs. Lobov,"April 22, 2017",2017-04-22,"Nashville, Tennessee, USA",ufc,http://www.ufcstats.com/event-details/bc7f7f0ba3db74d2,2026-03-16 21:20:25
14897e485279,UFC on FOX: Johnson vs. Reis,"April 15, 2017",2017-04-15,"Kansas City, Missouri, USA",ufc,http://www.ufcstats.com/event-details/ed069a95aaaf4f56,2026-03-16 21:20:25
3c162b106275,UFC 210: Cormier vs. Johnson 2,"April 08, 2017",2017-04-08,"Buffalo, New York, USA",ufc,http://www.ufcstats.com/event-details/e7bfdb5e0112891e,2026-03-16 21:20:25
702b95ec94a2,UFC Fight Night: Manuwa vs. Anderson,"March 18, 2017",2017-03-18,"London, England, United Kingdom",ufc,http://www.ufcstats.com/event-details/c0231720fe516994,2026-03-16 21:20:25
f6e1d34bd400,UFC Fight Night: Belfort vs. Gastelum,"March 11, 2017",2017-03-11,"Fortaleza, Ceara, Brazil",ufc,http://www.ufcstats.com/event-details/47b7e4e60813b7b2,2026-03-16 21:20:25
a704b002a6d0,UFC 209: Woodley vs. Thompson 2,"March 04, 2017",2017-03-04,"Las Vegas, Nevada, USA",ufc,http://www.ufcstats.com/event-details/20e403a1acfef130,2026-03-16 21:20:25
1854f77e45a9,UFC Fight Night: Lewis vs. Browne,"February 19, 2017",2017-02-19,"Halifax, Nova Scotia, Canada",ufc,http://www.ufcstats.com/event-details/b4ad3a06ee4d660c,2026-03-16 21:20:25
a49858fec607,UFC 208: Holm vs. De Randamie,"February 11, 2017",2017-02-11,"Brooklyn, New York, USA",ufc,http://www.ufcstats.com/event-details/865aa315ea62c511,2026-03-16 21:20:25
bfb71208e43f,UFC Fight Night: Bermudez vs. The Korean Zombie,"February 04, 2017",2017-02-04,"Houston, Texas, USA",ufc,http://www.ufcstats.com/event-details/6a8a06b542e1516d,2026-03-16 21:20:25
2115eba260f7,UFC on FOX: Shevchenko vs. Pena,"January 28, 2017",2017-01-28,"Denver, Colorado, USA",ufc,http://www.ufcstats.com/event-details/4512e46543b960ad,2026-03-16 21:20:25
021552a2d80e,UFC Fight Night: Rodriguez vs. Penn,"January 15, 2017",2017-01-15,"Phoenix, Arizona, USA",ufc,http://www.ufcstats.com/event-details/46effbd1135423c5,2026-03-16 21:20:25
978966ba73d5,UFC 207: Nunes vs. Rousey,"December 30, 2016",2016-12-30,"Las Vegas, Nevada, USA",ufc,http://www.ufcstats.com/event-details/4b2390cfaceb91d8,2026-03-16 21:20:25
5f7e6844a464,UFC on FOX: VanZant vs. Waterson,"December 17, 2016",2016-12-17,"Sacramento, California, USA",ufc,http://www.ufcstats.com/event-details/32541eb5d12668b4,2026-03-16 21:20:25
ecd8c86827fb,UFC 206: Holloway vs. Pettis,"December 10, 2016",2016-12-10,"Toronto, Ontario, Canada",ufc,http://www.ufcstats.com/event-details/6e3282d57d2467a0,2026-03-16 21:20:25
6fc467f6b3a5,UFC Fight Night: Lewis vs. Abdurakhimov,"December 09, 2016",2016-12-09,"Albany, New York, USA",ufc,http://www.ufcstats.com/event-details/7139cd2ae4bf6a29,2026-03-16 21:20:25
88a3c697857d,The Ultimate Fighter: Tournament of Champions Finale,"December 03, 2016",2016-12-03,"Las Vegas, Nevada, USA",ufc,http://www.ufcstats.com/event-details/bd4389b71fdc0ce2,2026-03-16 21:20:25
20e286029067,UFC Fight Night: Whittaker vs. Brunson,"November 26, 2016",2016-11-26,"Melbourne, Victoria, Australia",ufc,http://www.ufcstats.com/event-details/73e09f837f3b5ecc,2026-03-16 21:20:25
163e9957de67,UFC Fight Night: Bader vs. Nogueira,"November 19, 2016",2016-11-19,"Sao Paulo, Sao Paulo, Brazil",ufc,http://www.ufcstats.com/event-details/5cde96e0a1a1fffe,2026-03-16 21:20:25
68fd30f3f68f,UFC Fight Night: Mousasi vs. Hall 2,"November 19, 2016",2016-11-19,"Belfast, Northern Ireland, United Kingdom",ufc,http://www.ufcstats.com/event-details/6810d8d2dd557cf9,2026-03-16 21:20:25
5810c4d7bcb5,UFC 205: Alvarez vs McGregor,"November 12, 2016",2016-11-12,"New York City, New York, USA",ufc,http://www.ufcstats.com/event-details/4956f60b7fa57c1a,2026-03-16 21:20:25
8b9042378f37,UFC Fight Night: Dos Anjos vs. Ferguson,"November 05, 2016",2016-11-05,"Mexico City, Distrito Federal, Mexico",ufc,http://www.ufcstats.com/event-details/6083f497c22cc075,2026-03-16 21:20:25
64d6bff560d2,UFC 204: Bisping vs. Henderson,"October 08, 2016",2016-10-08,"Manchester, England, United Kingdom",ufc,http://www.ufcstats.com/event-details/154a6b3ffae264cd,2026-03-16 21:20:25
1aa8e7a62e94,UFC Fight Night: Lineker vs. Dodson,"October 01, 2016",2016-10-01,"Portland, Oregon, USA",ufc,http://www.ufcstats.com/event-details/a196332ee4aa8a82,2026-03-16 21:20:25
83f477190f34,UFC Fight Night: Cyborg vs. Lansberg,"September 24, 2016",2016-09-24,"Brasilia, Distrito Federal, Brazil",ufc,http://www.ufcstats.com/event-details/e18012194473e8b0,2026-03-16 21:20:25
209028e225f0,UFC Fight Night: Poirier vs. Johnson,"September 17, 2016",2016-09-17,"Hidalgo, Texas, USA",ufc,http://www.ufcstats.com/event-details/d6455cb4bee503ce,2026-03-16 21:20:25
91fb272b9585,UFC 203: Miocic vs. Overeem,"September 10, 2016",2016-09-10,"Cleveland, Ohio, USA",ufc,http://www.ufcstats.com/event-details/2dc7f1762dc0a7ef,2026-03-16 21:20:25
f38199b824e8,UFC Fight Night: Arlovski vs. Barnett,"September 03, 2016",2016-09-03,"Hamburg, Hamburg, Germany",ufc,http://www.ufcstats.com/event-details/2b4faacc16d66898,2026-03-16 21:20:25
6127d136c627,UFC on FOX: Maia vs. Condit,"August 27, 2016",2016-08-27,"Vancouver, British Columbia, Canada",ufc,http://www.ufcstats.com/event-details/cfbccfed4e4796fe,2026-03-16 21:20:25
b141d492548a,UFC 202: Diaz vs. McGregor 2,"August 20, 2016",2016-08-20,"Las Vegas, Nevada, USA",ufc,http://www.ufcstats.com/event-details/5da4e8dc02e50ac0,2026-03-16 21:20:25
bacc321e1fa1,UFC Fight Night: Rodriguez vs. Caceres,"August 06, 2016",2016-08-06,"Salt Lake City, Utah, USA",ufc,http://www.ufcstats.com/event-details/232c582f29f8f65e,2026-03-16 21:20:25
d78d93c338b3,UFC 201: Lawler vs. Woodley,"July 30, 2016",2016-07-30,"Atlanta, Georgia, USA",ufc,http://www.ufcstats.com/event-details/72cbe507644a587c,2026-03-16 21:20:25
e145a05177dd,UFC on FOX: Holm vs. Shevchenko,"July 23, 2016",2016-07-23,"Chicago, Illinois, USA",ufc,http://www.ufcstats.com/event-details/8a028648f3f0761d,2026-03-16 21:20:25
e57f6aa775cf,UFC Fight Night: McDonald vs. Lineker,"July 13, 2016",2016-07-13,"Sioux Falls, South Dakota, USA",ufc,http://www.ufcstats.com/event-details/5e7a28f20927d64a,2026-03-16 21:20:25
57fc2408a9f9,UFC 200: Tate vs Nunes,"July 09, 2016",2016-07-09,"Las Vegas, Nevada, USA",ufc,http://www.ufcstats.com/event-details/aa5b4eff51bdc7d1,2026-03-16 21:20:25
f1cf88100749,The Ultimate Fighter: Team Joanna vs. Team Cláudia Finale,"July 08, 2016",2016-07-08,"Las Vegas, Nevada, USA",ufc,http://www.ufcstats.com/event-details/cd42bbe8887bba90,2026-03-16 21:20:25
48e363e6e037,UFC Fight Night: Dos Anjos vs. Alvarez,"July 07, 2016",2016-07-07,"Las Vegas, Nevada, USA",ufc,http://www.ufcstats.com/event-details/45a2ba3ef82b9700,2026-03-16 21:20:25
56f132039fae,UFC Fight Night: MacDonald vs Thompson,"June 18, 2016",2016-06-18,"Ottawa, Ontario, Canada",ufc,http://www.ufcstats.com/event-details/563d051c9e769b24,2026-03-16 21:20:25
7a3ff0501188,UFC 199: Rockhold vs. Bisping 2,"June 04, 2016",2016-06-04,"Los Angeles, California, USA",ufc,http://www.ufcstats.com/event-details/ff4c3ab594c7fac3,2026-03-16 21:20:25
e757ad7d8934,UFC Fight Night: Almeida vs Garbrandt,"May 29, 2016",2016-05-29,"Las Vegas, Nevada, USA",ufc,http://www.ufcstats.com/event-details/990060b2a68a7b82,2026-03-16 21:20:25
72d9faef342a,UFC 198: Werdum vs Miocic,"May 14, 2016",2016-05-14,"Curitiba, Parana, Brazil",ufc,http://www.ufcstats.com/event-details/a4bf17bd3ba3423b,2026-03-16 21:20:25
f4cf6a23317e,UFC Fight Night: Overeem vs Arlovski,"May 08, 2016",2016-05-08,"Rotterdam, Zuid-Holland, Netherlands",ufc,http://www.ufcstats.com/event-details/a314687f372b2cec,2026-03-16 21:20:25
3b6b79d95249,UFC 197: Jones vs Saint Preux,"April 23, 2016",2016-04-23,"Las Vegas, Nevada, USA",ufc,http://www.ufcstats.com/event-details/3d481aa374c954a1,2026-03-16 21:20:25
e17f79b1088d,UFC on FOX: Teixeira vs Evans,"April 16, 2016",2016-04-16,"Tampa, Florida, USA",ufc,http://www.ufcstats.com/event-details/e7e970d508529bf3,2026-03-16 21:20:25
10e523f4395e,UFC Fight Night: Rothwell vs Dos Santos,"April 10, 2016",2016-04-10,"Zagreb, Croatia",ufc,http://www.ufcstats.com/event-details/4887e5bc4dbb73ff,2026-03-16 21:20:25
93ff371d7da0,UFC Fight Night: Hunt vs Mir,"March 19, 2016",2016-03-19,"Brisbane, Queensland, Australia",ufc,http://www.ufcstats.com/event-details/e60201cfab7d656d,2026-03-16 21:20:25
cd83a5ef6726,UFC 196: McGregor vs Diaz,"March 05, 2016",2016-03-05,"Las Vegas, Nevada, USA",ufc,http://www.ufcstats.com/event-details/db1f2ed63b54b9a7,2026-03-16 21:20:25
26b426d967aa,UFC Fight Night: Silva vs Bisping,"February 27, 2016",2016-02-27,"London, England, United Kingdom",ufc,http://www.ufcstats.com/event-details/39c568f8c579913e,2026-03-16 21:20:25
8569e4ecb4e5,UFC Fight Night: Cowboy vs Cowboy,"February 21, 2016",2016-02-21,"Pittsburgh, Pennsylvania, USA",ufc,http://www.ufcstats.com/event-details/d56bb6dff2ae77eb,2026-03-16 21:20:25
708819578136,UFC Fight Night: Hendricks vs Thompson,"February 06, 2016",2016-02-06,"Las Vegas, Nevada, USA",ufc,http://www.ufcstats.com/event-details/de99da2c0d18d34a,2026-03-16 21:20:25
e68f8744aefe,UFC on FOX: Johnson vs. Bader,"January 30, 2016",2016-01-30,"Newark, New Jersey, USA",ufc,http://www.ufcstats.com/event-details/b3fb8d2293e17a59,2026-03-16 21:20:25
66367050ae82,UFC Fight Night: Dillashaw vs Cruz,"January 17, 2016",2016-01-17,"Boston, Massachusetts, USA",ufc,http://www.ufcstats.com/event-details/c6becb722706c7d8,2026-03-16 21:20:25
7b3d64c799a4,UFC 195: Lawler vs Condit,"January 02, 2016",2016-01-02,"Las Vegas, Nevada, USA",ufc,http://www.ufcstats.com/event-details/380e8b023290d091,2026-03-16 21:20:25
